id,title,original_language,release_date,vote_average,vote_count,popularity,overview,genre_ids,adult,backdrop_path,poster_path,release_year,release_month,release_day
652572,Mom's Friend 6,ko,2019-11-08,3.4,4,21.56,"Jeong-hee goes home to take care of her sick mother. While Jeong-hee is gone, Yoon-soo convinces his father, Seok-jin, to call a housekeeper to do the chores while his mother his gone, and so comes Se-hee. Yoon-soo likes Se-hee and ends up sleeping with her. Seok-jin also ends up sleeping with her while receiving a massage from her.",10749,False,/yLJyLcTWecLAYDMwfdJ5jbwW17S.jpg,/fGl0JGTGNNgqT5XYwcR0BUmODA3.jpg,2019,11,8
515741,Angel of Mine,en,2019-08-15,6.224,270,21.51,A woman grieving over the death of her daughter loses grip of reality when she begins to think her girl may still be alive.,"18,53,9648",False,/61EpZBNVwXHgJmr0jPKO9qkIWnN.jpg,/q8IxjDRqJ7jFtt5Fn0jcXjiRVoF.jpg,2019,8,15
505600,Booksmart,en,2019-05-24,7.0,2600,21.292,"Two academic teenage superstars realize, on the eve of their high school graduation, that they should have worked less and played more. Determined to never fall short of their peers, the girls set out on a mission to cram four years of fun into one night.",35,False,/cheDSO3mYmsAFQlRM91o7MK6Wcc.jpg,/micaVOa1UZsdzs4fKGA67ZMGOzc.jpg,2019,5,24
617708,La Llorona,es,2019-07-25,6.4,325,21.146,"Accused of the genocide of Mayan people, retired general Enrique is trapped in his mansion by massive protests. Abandoned by his staff, the indignant old man and his family must face the devastating truth of his actions and the growing sense that a wrathful supernatural force is targeting them for his crimes.","53,27,18",False,/hXjK21t5S6WRR8HnG3apYpZ5lJW.jpg,/2AmTEIwxy1VkcZe32Fs34S37qJ2.jpg,2019,7,25
411144,We Have Always Lived in the Castle,en,2019-05-17,5.5,293,21.118,"In Shirleyville, Vermont, during the sixties, sisters Merricat and Constance, along with their ailing uncle Julian, confined to a wheelchair, live isolated in a big mansion located on the hill overlooking the town, tormented by the memories of a family tragedy occurred six years ago. The arrival of cousin Charles will threaten the fragile equilibrium of their minds, haunted by madness, fear and superstition.","9648,53,27",False,/wm5QhKgitszib5KjaWeNK6yAgoj.jpg,/2xg0n31TXPULoNuSeRNWPEHIcjF.jpg,2019,5,17
530382,In the Shadow of the Moon,en,2019-09-27,6.165,1400,21.036,"In 1988, Philadelphia police officer Thomas ""Locke"" Lockhart, hungry to become a detective, begins tracking a serial killer whose crimes defy scientific explanation. When the killer mysteriously resurfaces nine years later, Locke's obsession with finding the truth threatens to destroy his career, his family, and possibly his sanity.","878,53",False,/jJUK0IKdVvsTONsCVTVHQkEn7bZ.jpg,/5DSVYlKwEzGBxTkS95L73c3oxLs.jpg,2019,9,27
513576,Always Be My Maybe,en,2019-05-31,6.648,1307,21.006,"Reunited after 15 years, famous chef Sasha and hometown musician Marcus feel the old sparks of attraction but struggle to adapt to each other's worlds.","10749,35",False,/aC5LAGfHzVH8f7tkCwkxzXsqAZz.jpg,/3BO6pPa7qDcpPYct061Luh9fvst.jpg,2019,5,31
635744,Jarhead: Law of Return,en,2019-10-01,6.5,3338,20.976,"Major Ronan Jackson, an accomplished fighter pilot for the Israel Defense Forces and son of a U.S. Senator, is shot down while flying through Syrian airspace. After miraculously surviving the crash, Jackson is taken captive by a group of Hezbollah militiamen. A squad of elite soldiers, led by Gunnery Sergeant Dave Torres, risk their own lives in the hopes of saving an ally they've never met.",10752,False,/kTtBDUeDZATzrTUlqHUG0ZWjg9m.jpg,/6LlqyjAik3Kh68QQ9AchSJEF0Z5.jpg,2019,10,1
619278,Inside Man: Most Wanted,en,2019-09-24,6.5,279,20.965,An NYPD hostage negotiator teams up with a federal agent to rescue dozens of tourists held hostage during a 10-hour seige at the U.S. Federal Reserve.,"28,80,53",False,/OvMX5sgJ0vLmKQbIiS5yy7jn5H.jpg,/kxvxcgRHwV7T3PR4jNFDdQTLPm.jpg,2019,9,24
590009,Funhouse,en,2019-10-25,5.2,141,20.954,"When 8 celebrities from around the globe are invited to compete in an online reality show, they soon realize that they are playing for their very lives, as those voted off suffer horrific consequences, broadcast live to the entire world.",27,False,/eOGztSGUmqJyXhUawMnjQyb7ijv.jpg,/w9k8VvbO7vcFM6NgtgNRNwVmifl.jpg,2019,10,25
505948,I Am Mother,en,2019-06-07,6.695,2529,24.21,"A teenage girl is raised underground by a robot ""Mother"", designed to repopulate the earth following an extinction event. But their unique bond is threatened when an inexplicable stranger arrives with alarming news.","878,53",False,/8tqVlaXwF2vbMWMDa909IhdrTRc.jpg,/b3jWxwWRFqvNDJTvBcmKJVHnzKK.jpg,2019,6,7
536869,Cats,en,2019-12-19,4.073,959,15.089,A tribe of cats called the Jellicles must decide yearly which one will ascend to the Heaviside Layer and come back to a new Jellicle life.,"14,35,18",False,/3YDxwacSY2RT1JS62yeIZ7Jc9xi.jpg,/aCNch5FmzT2WaUcY44925owIZXY.jpg,2019,12,19
519010,Pain and Glory,es,2019-03-22,7.4,1764,24.034,"Salvador Mallo, a filmmaker in the twilight of his career, remembers his life: his mother, his lovers, the actors he worked with. The sixties in a small village in Valencia, the eighties in Madrid, the present, when he feels an immeasurable emptiness, facing his mortality, the incapability of continuing filming, the impossibility of separating creation from his own life. The need of narrating his past can be his salvation.",18,False,/m7DIYdiOiz57ukZlhWtYp9rDzPT.jpg,/cMlueArJXXwZbeLpb4NhC3pxmBk.jpg,2019,3,22
513302,Minuscule 2: Mandibles from Far Away,fr,2019-01-30,7.09,200,24.021,"When the first snow falls in the valley, it is urgent to prepare its reserves for the winter. Alas, during the operation, a small ladybug is trapped in a box - to the Caribbean. One solution: reform the shock team.","16,12,10751,35",False,/ucFj56P5fXnutVG2HWyDTIQLwVX.jpg,/QVglFM8WHuA5F07IMzFcKu6RXa.jpg,2019,1,30
553835,Is It Wrong to Try to Pick Up Girls in a Dungeon?: Arrow of the Orion,ja,2019-02-15,7.8,248,18.83,"In the city of Orario, beneath an impossibly tall tower, lies the dungeon. Only adventurers who form partnerships with the gods themselves have any hope of defeating the monsters that lie within. But the dungeon is not the only place where monsters exist. Far from Orario, in the ruins of an ancient city, a new threat arises. To counter this threat, the goddess Artemis has come to Orario in search of a champion—but it’s not Ais Wallenstein (the legendary Sword Princess) nor Ottar (the strongest warrior to ever enter the dungeon) that she chooses. Rather it is Bell Cranel, a newbie adventurer partnered with a low-tier goddess.","16,28,12,35,14,10749",False,/zlpKUEE4A5LjaTmEz37pw2VZQug.jpg,/78x3RRydNXvdB8BhJAwZz42g1Q1.jpg,2019,2,15
591278,Game of Thrones: The Last Watch,en,2019-05-26,7.1,323,23.981,"For a year, acclaimed British filmmaker Jeanie Finlay was embedded on the set of the hit HBO series “Game of Thrones,” chronicling the creation of the show’s most ambitious and complicated season.  Debuting one week after the series 8 finale, GAME OF THRONES: THE LAST WATCH delves deep into the mud and blood to reveal the tears and triumphs involved in the challenge of bringing the fantasy world of Westeros to life in the very real studios, fields and car-parks of Northern Ireland.  Made with unprecedented access, GAME OF THRONES: THE LAST WATCH is an up-close and personal portrait from the trenches of production, following the crew and the cast as they contend with extreme weather, punishing deadlines and an ever-excited fandom hungry for spoilers.  Much more than a “making of” documentary, this is a funny, heartbreaking story, told with wit and intimacy, about the bittersweet pleasures of what it means to create a world – and then have to say goodbye to it.",99,False,/6hfmHRaZNKzazyDDLli5CbT6L8H.jpg,/tVyKpOYDtKzs4SOYCbZn4YNFWHI.jpg,2019,5,26
542417,Skin,en,2019-07-26,7.0,403,19.32,"A destitute young man, raised by racist skinheads and notorious among white supremacists, turns his back on hatred and violence to transform his life, with the help of a black activist and the woman he loves.","18,80,36,10749",False,/etyZEgWCf46AzKKDMQcLoiYKwec.jpg,/7ryH8Noh6VKE4L42yhpR5jqIGsF.jpg,2019,7,26
532067,KONOSUBA – God's blessing on this wonderful world! Legend of Crimson,ja,2019-08-30,8.1,543,23.319,"It is not strange that the Demon Lord's forces fear the Crimson Demons, the clan from which Megumin and Yunyun originate. Even if the Demon Lord's generals attack their village, the Crimson Demons can just easily brush them off with their supreme mastery of advanced and overpowered magic.  When Yunyun receives a seemingly serious letter regarding a potential disaster coming to her hometown, she immediately informs Kazuma Satou and the rest of his party. After a series of wacky misunderstandings, it turns out to be a mere prank by her fellow demon who wants to be an author. Even so, Megumin becomes worried about her family and sets out toward the Crimson Demons' village with the gang.  There, Kazuma and the others decide to sightsee the wonders of Megumin's birthplace. However, they soon come to realize that the nonsense threat they received might have been more than just a joke.","16,12,35,14",False,/wqpTrmGiqMJ6onAq3zrBhfomIJl.jpg,/fv5BgcfkpWh3V6Pb1qVlXESBOdl.jpg,2019,8,30
513045,Stuber,en,2019-07-11,6.646,1280,23.813,"After crashing his car, a cop who's recovering from eye surgery recruits an Uber driver to help him catch a heroin dealer. The mismatched pair soon find themselves in for a wild day of stakeouts and shootouts as they encounter the city's seedy side.","28,35",False,/xgfn98c2UzvFWP6MXDzytearmQ3.jpg,/klkFYDZOetegK8floj6IjvbzzQ2.jpg,2019,7,11
763633,"My Sister, Sister, Sister...",ko,2019-01-01,6.0,1,15.08,"I was once a novelist who was looking forward to the future, but now I am living in a house that is just a handful. I have to write, but the enthusiasm for writing has long been lost. One day when I was bored every day, my friend (Jane) of Sukjep (exponent) comes home. Jane pulls the hair out of her face with a sweaty face on a hot summer day and sits on the front door. When I saw Jane who seemed innocent and innocent and sexy, my heart was rocked ...","10749,18",False,,/ebq7uYRnmYqtrOjGdrfJDkyJewG.jpg,2019,1,1
574303,Jo Pil-ho: The Dawning Rage,ko,2019-03-20,6.1,115,15.298,"On the run from a dogged internal affairs agent, a corrupt cop reluctantly teams up with a defiant teen to unravel a conspiracy before it's too late.","28,80,18,53",False,/57rzB3e08jiNexS4tq1K5efdLe.jpg,/k4QPUYRupu7Jv8ZWS9hiLw5OuhB.jpg,2019,3,20
539651,Don't Let Go,en,2019-08-30,6.844,379,19.794,"A detective suffering from a personal loss receives a call from his recently deceased niece. Being able to communicate across time, the two work together to try and stop the crime before it occurs.","878,53,9648,27",False,/7TWBC3JzOB0IeFKYjMQ1arTlTm8.jpg,/uNHueGo5TYCTLzoGULse65GC32Q.jpg,2019,8,30
520905,Tone-Deaf,en,2019-03-10,5.4,85,23.633,"A woman leaves for a quiet weekend in the country after losing her job and imploding her latest dysfunctional relationship.  She rents a country house from an old-fashioned widower who’s struggling to hide his psychopathic tendencies. Soon, two generations collide with terrifying results.","27,53,35",False,/aIgSmuJg33djRkNpVuIiPjB45sU.jpg,/1yHOLVfLHnbAHYqxV2PwtE32kBm.jpg,2019,3,10
501907,A Beautiful Day in the Neighborhood,en,2019-09-07,7.0,1598,16.79,"An award-winning cynical journalist, Lloyd Vogel, begrudgingly accepts an assignment to write an Esquire profile piece on the beloved television icon Fred Rogers. After his encounter with Rogers, Vogel's perspective on life is transformed.","18,36",False,/cSJMk9Jar8SibFXL8JAF9p2fhKu.jpg,/p9vCAVhDK375XyobVcKqzqzsUHE.jpg,2019,9,7
471506,Greta,en,2019-02-28,6.569,1321,17.537,"A young woman returns a lonely widow’s lost purse, leading to an unlikely relationship between the two — until the young woman discovers the widow might not be all that she seems.","9648,53,27",False,/6CmaRROvzd0IURIUOz967ZG7ltb.jpg,/9hBpFyJ3pGdupXbaC2L7nGvLMBn.jpg,2019,2,28
400157,Wonder Park,en,2019-03-13,6.5,691,16.031,"A young girl named June with a big imagination makes an incredible discovery -- the amusement park of her dreams has come to life. Filled with the world's wildest rides operated by fun-loving animals, the excitement never ends. But when trouble hits, June and her misfit team of furry friends begin an unforgettable journey to save the park.","35,16,12,10751,14",False,/nJyAdKPnW15IAvC6sLBTE0lp6Dv.jpg,/8KomINZhIuJeB4oB7k7tkq8tmE.jpg,2019,3,13
510242,Psycho-Pass: Sinners of the System - Case.1 Crime and Punishment,ja,2019-01-25,6.6,77,23.538,"In the winter of 2117, a runaway vehicle crashes into the Public Safety Bureau Building. The driver is identified as Izumi Yasaka, a psychological counselor at the Sanctuary, a Latent Criminal Isolation Facility in Aomori Prefecture. But right before her interrogation, Inspector Mika Shimotsuki and Enforcer Nobuchika Ginoza are tasked with promptly escorting Yasaka back to Aomori. What awaits them there is a False Paradise.","16,878,80",False,/pieDnLArEw43kZxYejn3XbrNZdg.jpg,/qnG8ZcmQoncPB58RZwy3wofxm5y.jpg,2019,1,25
421473,Above Suspicion,en,2019-06-20,5.9,282,23.5,"The chilling true story of a newly married FBI poster boy assigned to an Appalachian mountain town in Kentucky. There he is drawn into an illicit affair with an impoverished local woman who becomes his star informant. She sees in him her means of escape; instead, it's a ticket to disaster for both of them.","53,80,28",False,/7tFaEJ7EbIoKbLIuifKmUbdjFSh.jpg,/kpZ2SfwLHjuf2HmgaFko32cPgbl.jpg,2019,6,20
292011,Richard Jewell,en,2019-12-13,7.4,2479,18.51,"Richard Jewell thinks quick, works fast, and saves hundreds, perhaps thousands, of lives after a domestic terrorist plants several pipe bombs and they explode during a concert, only to be falsely suspected of the crime by sloppy FBI work and sensational media coverage.",18,False,/zAfG4ZmpNfKSyr8MVn1CHjgYYXx.jpg,/5Lgkm8jt4roAFPZQ52fKMhVmDaZ.jpg,2019,12,13
510298,Seberg,en,2019-12-13,5.9,254,23.271,An ambitious young FBI agent is assigned to investigate iconic actress Jean Seberg when she becomes embroiled in the tumultuous civil rights movement in late 1960s Los Angeles.,"53,18",False,/cdMfn0Jr9RGqKkaX9HyR5l1kiYy.jpg,/kv78WJ2YvWyk3c32sbOGFh64xcs.jpg,2019,12,13
512263,Honey Boy,en,2019-09-28,7.1,665,19.821,"The story of a child star attempting to mend his relationship with his law-breaking, alcohol-abusing father over the course of a decade, loosely based on Shia LaBeouf’s life.",18,False,/5n2jz145P1CRdPfA296MmEZF1sQ.jpg,/3BZ2rBn31kWER45ZMj7OTe9keMm.jpg,2019,9,28
582570,Sextuplets,en,2019-08-16,6.2,834,19.82,"Father-to-be Alan is shocked to learn that he was born a sextuplet. With his newfound brother Russell riding shotgun, the duo sets out on a hilarious journey to reunite with their remaining long-lost siblings.",35,False,/h9cKOZs5z0fVmM9cZ4RPBvcojK5.jpg,/ztGSEcowBoHyRwcK0s5kIKVVXwy.jpg,2019,8,16
570503,Tune in for Love,ko,2019-08-28,7.8,276,19.813,"During the 1990s, hardworking Mi-soo and optimistic Hyun-woo meet at a bakery and fall in love while exchanging stories on a radio station, but while their paths keep crossing, the timing never seems to work out.","10749,18",False,/5sSCPzLhX9Ho7Llpj5N3ECjqYai.jpg,/3UPLFX5GFtSR61rdy1ck85lfbrV.jpg,2019,8,28
607426,Tempting Fate,en,2019-06-15,5.8,30,19.811,"Gabby's picture perfect marriage to Elliott is jeopardized when she meets Matt, a handsome younger man who ignites a fire and desire within her. Based on the New York Times best-selling novel of the same name.","18,10749,10770",False,/8CbPW9sHVOfsORkpixReSAG3K7a.jpg,/i35JUTjmyLG9oWOpJYUwm3vTf6q.jpg,2019,6,15
539651,Don't Let Go,en,2019-08-30,6.844,379,19.794,"A detective suffering from a personal loss receives a call from his recently deceased niece. Being able to communicate across time, the two work together to try and stop the crime before it occurs.","878,53,9648,27",False,/7TWBC3JzOB0IeFKYjMQ1arTlTm8.jpg,/uNHueGo5TYCTLzoGULse65GC32Q.jpg,2019,8,30
575813,Better Days,zh,2019-10-25,8.117,443,19.784,"A bullied teenage girl forms an unlikely friendship with a mysterious young man who protects her from her assailants, while she copes with the pressures of her final examinations.","18,10749,53,80",False,/pi3yXaJzVxZUayUfqMekcsN199A.jpg,/ev8PDIuKm2j3m3jWxw497zCLjzu.jpg,2019,10,25
605373,The Influence,es,2019-06-21,4.9,252,19.782,"After moving back to her family home to care for her dying mother, a nurse haunted by her childhood memories must struggle with an evil force in the house.",27,False,/j0gADYc94vowdGeANLceDCKleKt.jpg,/xGUMfHIiEzuNVGeRAggLprzo1gG.jpg,2019,6,21
853033,Adultery Alumni Association 2,ko,2019-02-18,4.4,36,19.713,"Hye Jin, Hee Kyung, and Han Hee who are among the high school alumni. They met at the alumni meeting and heard that the male alumni who did not have a chance to study during their school days were greatly successful as an investment company. And after seeing the settlement a few days later, I am happy to share my memories, but in fact, their purpose (?) Is separate. They are difficult to afford, and they want to get help from Zhengzhou. Since then, Zhengzhou has been enjoying the love of female alumni.","18,10749",False,/AaUpn8zfBmCy6TRNcS29yLWmEh1.jpg,/wJHAEuL4ObSAp33T2iADrti0fAM.jpg,2019,2,18
594692,Mother,es,2019-11-11,6.673,107,19.674,"Ten years have gone by since Elena's six-year old son has disappeared.  The last thing she heard of him was a phone call he gave her, saying that he was lost on a beach in France and couldn't find his father.  Nowadays, Elena lives on this same beach and manages a restaurant. She is finally beginning to emerge from this tragic episode when she meets a French teenager who strongly reminds her of her lost son.  The two of them will embark on a relationship which will sow chaos and distrust around them.","18,53",False,/eZGfcExvsCHX0Vv7p1fRwpKlXoW.jpg,/j8wRmze5yJ9uN9zrvXpx9ZcfoO2.jpg,2019,11,11
596054,Heroic Losers,es,2019-08-15,7.581,555,19.614,"In a town in the Northwest of the province of Buenos Aires, a group of neighbors is organized to recover the economy of the area, but when the corralito is implemented in the country and they suffer a fraud, their hopes disappear. Now, they will unite to recover the lost money and give the blow of their lives to their greatest enemy.","35,53",False,/1lVzpmCxVd7SNSswEIfFND4I2si.jpg,/AazrWNGNmpZBfIMCFKyfDpkwQC5.jpg,2019,8,15
526050,Little,en,2019-04-04,6.9,707,19.569,"Jordan Sanders, a take-no-prisoners tech mogul, wakes up one morning in the body of her 13-year-old self right before a do-or-die presentation. Her beleaguered assistant April is the only one in on the secret that her daily tormentor is now trapped in an awkward tween body, just as everything is on the line.","35,14,10749",False,/2hhZZCbLllEwcED7S9yLIA6j6aZ.jpg,/4MDB6jJl3U7xK1Gw64zIqt9pQA4.jpg,2019,4,4
645488,Aquaman: Heroines of Atlantis,en,2019-03-26,6.2,51,19.514,Amber Heard and Nicole Kidman discuss their characters Mera and Atlanna.,99,False,/f1i4ecVuDo3AQSvqzRtijnD4hzN.jpg,/pa7m8nqDrEi7hAGB5vTnCkGLPC2.jpg,2019,3,26
597856,Critters Attack!,en,2019-07-13,5.6,212,19.503,"Follows 20-year-old Drea, who reluctantly takes a job babysitting for a professor of a college she hopes to attend. Struggling to entertain the professor's children Trissy and Jake, along with her own little brother Phillip , Drea takes them on a hike, unaware that mysterious alien critters have crash-landed and started devouring every living thing they encounter.","35,27,878",False,/32HqRM2XTccuEpYuERTSLnbAeBZ.jpg,/iQJQNElDQqQ3iXf46pyMmhReoyp.jpg,2019,7,13
570480,Trouble,en,2019-08-08,6.582,220,19.49,A pampered dog named Trouble must learn to live in the real world while trying to escape from his former owner's greedy children and must learn how to survive on the big-city streets.,"16,12,10751,35,10402",False,/dAWoR2TMUJHzpEEuxSmElsRO1av.jpg,/yfTXk9T3iNxuOcnA72AirzueLxL.jpg,2019,8,8
592867,Dragon Quest: Your Story,ja,2019-08-02,6.7,207,19.473,Luca follows in his father's footsteps to rescue his mother from evil Ladja. Finding the heavenly hero who wields the Zenithian sword is his only hope.,"16,12,35,14,28,10751",False,/vKhp5yhdtPkKsBOYXMjb5Yi05e7.jpg,/5R70ehKGh5V0ZYOdikxwSfoLGMt.jpg,2019,8,2
534490,Avengement,en,2019-05-24,6.8,486,19.462,"While on a prison furlough, a lowly criminal evades his guards and returns to his old stomping ground to take revenge on the people who turned him into a cold blooded killer.","80,28",False,/glNHP57gEZqm42ybpToCV9oZ1AP.jpg,/rXPxSAYf3FdQktnOtQnvhUPMhFp.jpg,2019,5,24
508791,The Sun Is Also a Star,en,2019-05-16,6.967,586,19.428,"Two young New Yorkers begin to fall in love over the course of a single day, as a series of potentially life-altering meetings loom over their heads - hers concerning her family’s deportation to Jamaica, and his concerning an education at Dartmouth.","10749,18",False,/3CFuFIwtSSQU4Fyd5NnmHnNZq9w.jpg,/pYfI62qgone3Ai0tzgxtQq7chDE.jpg,2019,5,16
595975,La Belle Époque,fr,2019-11-06,7.369,996,19.396,"Victor, a disillusioned 60-something whose marriage is on the rocks, opts to relive the week of his life when, 40 years earlier, he met his true love through a company that allows customers to return to the time period of their choosing.","35,18",False,/jxk1Xsk3qEtscMt2mDAVdZslXWK.jpg,/eHojoVxYRyqGABgoiTYyfkYqTra.jpg,2019,11,6
602797,Hot Gimmick: Girl Meets Boy,ja,2019-06-28,5.8,53,19.363,"A quiet teen's life is shaken up when she's forced to be her arrogant neighbor's slave. He loves her, but they both have a lot to learn about trust.","18,10749",False,/s1HoYuyJhydLmI3TAVZuhaXKKcv.jpg,/pdlisiIaZrPUTqP9kNo6hCgHikj.jpg,2019,6,28
603772,Little Q,cn,2019-08-15,7.6,104,19.356,"Little Q is an aspiring guide dog, training to be a guide for the blind. Soon Little Q is partnered with Bo-ting, a renowned pastry chef who’s losing his sight. But Bo-ting is irritable and reluctant, constantly losing his temper at those around him and rejecting Little Q. Eventually, dog and owner bond as Little Q wins Bo-ting over with its unwavering loyalty. However, as Little Q gets older and Bo-ting’s health suffers, the two of them face an unwilling separation...","18,10751",False,/zULVExh8h226IkxgDHI6zJAi76i.jpg,/9GayeewWQCSr3mzgquPRPTGhHBC.jpg,2019,8,15
542417,Skin,en,2019-07-26,7.0,403,19.32,"A destitute young man, raised by racist skinheads and notorious among white supremacists, turns his back on hatred and violence to transform his life, with the help of a black activist and the woman he loves.","18,80,36,10749",False,/etyZEgWCf46AzKKDMQcLoiYKwec.jpg,/7ryH8Noh6VKE4L42yhpR5jqIGsF.jpg,2019,7,26
504949,The King,en,2019-10-11,7.154,3206,19.262,"England, 15th century. Hal, a capricious prince who lives among the populace far from court, is forced by circumstances to reluctantly accept the throne and become Henry V.","18,36,10752",False,/urwWVsciRiNSmhtMJcck0noWAXr.jpg,/8u0QBGUbZcBW59VEAdmeFl9g98N.jpg,2019,10,11
591121,Maria,tl,2019-03-07,6.1,148,19.261,"When a former BlackRose cartel assassin deliberately betrays them by refusing to complete her mission, the cartel orders her execution. Unbeknownst to them, she fakes her own death and is able to create a new life of her own. When the cartel discovers she is alive, the hunter becomes the hunted as she fights to get revenge on those who took her new life away from her.","28,80",False,/4mCzkDzNvIJYIQscGFTeqZHNDra.jpg,/zJ1ePsQmB984EvTOaKXfIliKsCV.jpg,2019,3,7
339395,Georgetown,en,2019-05-14,5.9,180,19.258,"Ulrich Mott  is an eccentric and versatile social climber with grandiose plans to affect United States foreign policy. Encouraged  in his attempts by his strategically chosen (and much older) wife, the well-connected journalist Elsa Brecht, Mott has a knack for making himself indispensable and impossible to ignore. The only one seemingly immune to his charms is Elsa's daughter Amanda, who might simply disapprove of her mother marrying a much younger man - or perhaps she senses something more sinister beneath the smooth-talking surface?","80,18",False,/1nQLjdiGjl8R76DTbjd3TRqgsq.jpg,/pfBZObVPRNFA47jU22iaYH19Rdy.jpg,2019,5,14
615453,Ne Zha,zh,2019-07-26,7.9,397,19.156,"The Primus extracts a Mixed Yuan Bead into a Spirit Seed and a Demon Pill. The Spirit Seed can be reincarnated as a human to help King Zhou establish a new dynasty, whereas the Demon Pill will create a devil threatening humanity. Ne Zha is the one who is destined to be the hero, but instead he becomes a devil incarnate, because the Spirit Seed and a Demon Pill are switched.","16,14,12",False,/eGK2JJO1ZeoabWThHmC9IjUTmfP.jpg,/vhnxaQel1CwfcwLtCkTNpSdjte1.jpg,2019,7,26
533642,Child's Play,en,2019-06-19,5.953,1875,19.139,"Karen, a single mother, gifts her son Andy a Buddi doll for his birthday, unaware of its more sinister nature. A contemporary re-imagining of the 1988 horror classic.","27,53",False,/8Vjfen3Jit0nsMtu8huT09UqmsS.jpg,/rpS7ROczWulqfaXG2klYapULXKm.jpg,2019,6,19
431075,Polaroid,en,2019-01-10,6.043,1033,19.069,"High school loner Bird Fitcher has no idea what dark secrets are tied to the mysterious Polaroid vintage camera she stumbles upon, but it doesn't take long to discover that those who have their picture taken meet a tragic end. Bird and her friends must survive one more night as they race to solve the mystery of the haunted Polaroid before it kills them all.","27,53,9648",False,/nzMdjuUZ6LR3XheCG5VGwm5vYEY.jpg,/6a1iqhfM0Y31kNPOSNPIuPrsYQ6.jpg,2019,1,10
