id,title,original_language,release_date,vote_average,vote_count,popularity,overview,genre_ids,adult,backdrop_path,poster_path,release_year,release_month,release_day
487437,White as Snow,fr,2019-04-10,5.1,95,11.074,"Claire is a beautiful young woman who works at her late father’s hotel, that is now managed by her evil stepmother Maud. Claire unwittingly sparks uncontrollable jealousy in Maud, whose young lover has fallen in love with Claire. Maud decides to get rid of Claire who finds shelter in a farm where she’s allowed to break free from her strict upbringing through encounters with seven “princes.”","35,18",False,/e7kMJtCtrVLjaaGaKsjq0kEF1YF.jpg,/vOo0cXSb5c5B4SJFRJwXosuYpJV.jpg,2019,4,10
574207,The Operative,en,2019-07-24,5.9,211,11.072,A young Western woman is recruited by the Mossad to go undercover in Tehran where she becomes entangled in a complex triangle with her handler and her subject.,"18,53",False,/p7b1IEXvtuYMZwDJSAIYFW7GbWn.jpg,/ue9co4q7ilbjThuy0hUIYxinCzg.jpg,2019,7,24
599744,Tooth Fairy,en,2019-04-30,5.266,79,11.07,"Nana starts to tell the legend of the evil tooth fairy who rips out teeth. Carla is sick of her crazy alcoholic stories and tries to leave, however a power outage suggests something is amiss, something much more sinister than Carla could imagine.","27,53",False,/w2UbTUx8cjbnuwktJ5MxfCPPIaB.jpg,/7uA6nSvazBeSKSDEgurpHXgmxLZ.jpg,2019,4,30
505706,The Golden Glove,de,2019-02-21,6.9,508,11.063,A serial killer strikes fear in the hearts of residents of Hamburg during the early 1970s.,"80,53",False,/5CpXLhwcjnupeC5Ll3hMoCMJf1l.jpg,/wi9K8quRC3oYfFjGrO7CODR5nWC.jpg,2019,2,21
471707,Corpus Christi,pl,2019-09-10,7.6,535,11.062,"A pious 20-year-old juvenile delinquent is sent to work at a sawmill in a small town; on arrival, he dresses up as a priest and accidentally takes over the local parish. The arrival of this young, charismatic preacher is an opportunity for the local community to begin the healing process after a tragedy that happened a year prior.",18,False,/sVWUcBHwq2LQtDeqwXzI1uMpA3h.jpg,/6VZlm8sEwxkE3L5nXxz17QLj1sF.jpg,2019,9,10
609189,Into the Ashes,en,2019-07-19,5.1,73,11.056,"With an honest job and a loving wife, Nick Brenner believed he had safely escaped his violent, criminal history. But his old crew hasn't forgotten about him or the money he stole, and when they take what Nick now values the most - his wife - he has nothing left to lose. Confronted by the town sheriff, who is also his father-in-law, Nick must decide if he will stay on his new path or indulge in his need for revenge and force his enemies to pay for what they have done.","80,53,18,9648",False,/12r1Oi9NRBgvguZYE1mpFXkdsh6.jpg,/xSTsGP8EUVk26L1khj6uOv2n3f9.jpg,2019,7,19
596870,"A White, White Day",is,2019-07-25,6.2,104,11.025,"In a remote Icelandic town, an off duty police chief begins to suspect a local man to have had an affair with his wife, who has recently died in a car accident. Gradually his obsession for finding out the truth accumulates and inevitably begins to endanger himself and his loved ones. A story of grief, revenge and unconditional love.",18,False,/2A4LEE1EZoCmb8f5mcQdCGRCnIN.jpg,/vsx5tFeL3UuWa5ITqu6l8uLc7q5.jpg,2019,7,25
626285,A Christmas Wish,en,2019-11-28,6.736,36,11.011,"Every December in the small town of Ponchatoula, Louisiana a wooden wishing box is placed in the park as a Christmas tradition. After a night out together, Maddie encourages her sister Faith to put a wish in the box - a wish to experience true love for the first time. Faith and Maddie are surprised the next day when she meets the very handsome and eligible Andrew. As Christmas nears, Faith begins to wonder if Andrew is really perfect for her, or if the wish is leading her to her best friend, Wyatt.","10749,10770",False,/60bjY85m7hBf5beqd4HV6xzFDWd.jpg,/bLMbRhRZwWQ37ku2Ca9yV2ALhJy.jpg,2019,11,28
492565,The Kid,en,2019-03-08,6.0,287,10.981,"New Mexico Territory, 1880. Rio Cutler and his older sister Sara must abandon their home after an unfortunate event happens. In their desperate flee to Santa Fe, they cross paths with the infamous outlaw Billy the Kid and his gang, who are ruthlessly pursued by a posse led by Sheriff Pat Garret.","37,18,28",False,/qogeijTQKJB3XtopMolADVQcnBG.jpg,/8zWFMU70cFbKZ45QWQnsfxV1RPz.jpg,2019,3,8
639609,Holiday Rush,en,2019-11-28,5.6,214,10.965,"After his sudden firing, a popular radio DJ moves in with his aunt, bringing along his four spoiled children, and a plan to return to the airwaves.","18,35,10749",False,/1NSjj7AnAbAUXHAJv3a14yC3h4E.jpg,/ccL8XtMJSAl5VRoOdyKn7Cd0QA2.jpg,2019,11,28
449684,Girls with Balls,fr,2019-07-26,4.2,235,10.959,"All girls volley ball team The Falcons end up stranded in the middle of nowhere after their mini-van breaks down. Little do they know they landed in degenerate hunters' territory and the hunt is on. Thus begins a very long night where they must run for their lives and test their team spirit. But the girls are more resourceful than it appears. In the heart of the forest, the tables are about to turn between hunter and hunted...","27,35",False,/2N391Zp3MwPrpTCp2hdo2zQyzqw.jpg,/hnJ8H5DvwHG5jktB9CA0n6rmYxs.jpg,2019,7,26
641790,Trauma Center,en,2019-12-06,5.5,374,10.944,"Lt. Wakes is a vengeful police detective determined to solve the murders of his partner and an informant, and joins forces with a witness injured during the shootings. After the killers pursue the witness across the abandoned floor of a hospital, she confirms Wakes's worst fears.","28,53",False,/ifBIpsuutQlul3Mexjw2QdkFXG4.jpg,/8K73wvCTBA3XKgZTtOZWgENUnis.jpg,2019,12,6
608052,Kindred Spirits,en,2019-06-16,6.2,37,10.923,"Single mother Chloe has her life turned upside down when her younger sister, Sadie, comes home after a long, unexplained absence. Though Sadie seems to want to settle in with her sister and 17-year-old niece, it soon becomes apparent that she may have sinister intentions.","18,53,10770",False,/5kBf00ubks5s7WaO36OTapJbpzt.jpg,/qkIimU6crkaoBHdExqkkLbOgtPF.jpg,2019,6,16
566387,12 Suicidal Teens,ja,2019-01-25,6.3,72,10.921,"Twelve boys and girls gather at an abandoned hospital to die for various different reasons. There, they find the body of a dead boy. The twelve boys and girl attempt to find the person who killed the boy. During their search, the reasons why they want to die are revealed.","9648,18",False,/uKC9ykxF3tCqfvL4RgLyttTKHQv.jpg,/h5yAnJxRuiLPabIrwinqGbCGetQ.jpg,2019,1,25
366668,Playmobil: The Movie,en,2019-06-10,5.6,275,10.9,Marla is forced to abandon her carefully structured life to embark on an epic journey to find her younger brother Charlie who has disappeared into the vast and wondrous animated world of Playmobil toys.,"10751,16,35,12",False,/axmxVeX5R1FfN7w4LNFehskDxW1.jpg,/zPQzLZnfVw9fbXyxxglyOsmQBlu.jpg,2019,6,10
533715,The Big Trip,ru,2019-04-27,7.0,70,10.884,"A goofy stork mistakenly delivers a baby panda to the wrong door. A bear, a moose, a tiger and a rabbit set on an arduous but fun-filled adventure through the wilderness to return the panda to its rightful home.","16,35,12,10751",False,/vFrcOINNiY1eBjmIDhG0rR25hDZ.jpg,/31a41CbwpsG9jRrWifmte4nNJWe.jpg,2019,4,27
405177,"Where'd You Go, Bernadette",en,2019-08-16,6.607,649,10.871,"When architect-turned-recluse Bernadette Fox goes missing prior to a family trip to Antarctica, her 15-year-old daughter Bee goes on a quest with Bernadette's husband to find her.","35,18",False,/q5W3ddBLhocYhMUyvEHHhEryfVP.jpg,/BziuuZULnGmTRLthEty1QdKSEo.jpg,2019,8,16
595931,The Climb,en,2019-05-17,6.1,129,10.86,"Kyle and Mike are best friends who share a close bond — until Mike sleeps with Kyle’s fiancée. A stormy but enduring relationship ensues between Kyle, with limitless patience, and Mike, who only lives his life by sowing discord in that of others, across many years of laughter, heartbreak, and rage.",35,False,/7O4FQBE5QNmSODvTgQov6DtoExm.jpg,/x6f60UzIXfkFNofg7GTzMygegFc.jpg,2019,5,17
606215,The Black Godfather,en,2019-06-07,6.9,31,10.844,"Follows the life of Clarence Avant, the ultimate, uncensored mentor and behind-the-scenes rainmaker in music, film, TV and politics.","99,10402",False,/3otb50i2hzoToonuOaKn1ZQws9u.jpg,/3BQArnXPwM5nHeS1tlGKLY7eapP.jpg,2019,6,7
556509,Svaha: The Sixth Finger,ko,2019-02-20,6.8,172,10.843,"Pastor Park, the head of a religious investigation center that exposes cults and cult leaders, begins looking into a suspicious new religion called Deer Mount.","27,9648,53,80",False,/vUTx2JxgDPRW3MYzXwGZXkhSWGV.jpg,/yE6q03pfWg9xZ4a7MoeldDXMV5y.jpg,2019,2,20
570661,The Collini Case,de,2019-04-18,7.4,383,10.84,A young lawyer stumbles upon a vast conspiracy while investigating a brutal murder case.,"18,53",False,/8Vqny8wNC5FQab04pYGgAZbMghv.jpg,/crfpuX2d6TAGxQl3lnV2t3FIWmx.jpg,2019,4,18
614488,Street Flow,fr,2019-10-12,6.9,345,10.839,"Noumouké, from the suburb of Paris, is about to decide which brother's foot steps to follow - the lawyer student Soulaymaan or the gangster Demba.","18,80",False,/jH1f7VaYtMCyqgJRoG7lCg8krxO.jpg,/rhOFpiEDA9S2rmuz5990KBjLgcP.jpg,2019,10,12
561557,The Ash Lad: In Search of the Golden Castle,no,2019-08-23,6.5,110,10.831,"When the King and Queen are poisoned, brothers Per and Pål get arrested, suspected of being behind it. Younger brother Espen ""Ash Lad"" and Princess Kristin set out on a quest to find the mythical Soria Moria castle, which is said to be built of pure gold. In Soria Moria, there sits a well containing the Water of Life; the only thing that can cure Kristin's parents. But some wicked Danes are also on the hunt to find the castle. If Espen and Kristin fail, it will spell the end for the brothers, the kingdom - and perhaps the entire world.","14,12",False,/tnZQoWD0WetNQe81kNHFMa7E7FR.jpg,/5LVjFm8tGRtpapvexWi6RaXEHOC.jpg,2019,8,23
522645,Bastaard,nl,2019-10-02,5.5,15,10.83,"Two years after the tragic loss of his older brother, 17-year-old Daan unwillingly goes along when his grieving family decides to give shelter to a homeless teenager called Radja. But as Daan witnesses how this stranger's presence deeply affects his mother, he starts to unravel Radja's mysterious past.",53,False,/pr8yC2eHVkLsdXLYcmQ3Ci6P1gf.jpg,/3jQsFqoXsIOFOC2uZKt1Gxuwxqc.jpg,2019,10,2
626323,Picture a Perfect Christmas,en,2019-11-09,6.625,40,10.829,"A Los Angeles extreme-sports photographer returns home for the holiday to take care of her grandmother, only to have a neighbor grab her attention as he needs assistance watching his young nephew.","10749,10770,18,35",False,/tfv2syiRg2rMosU6TLYRHUUmcAb.jpg,/6j8XUqPooxOzx8yLQIwFnvhf7k6.jpg,2019,11,9
607334,Adventures of Dally and Spanky,en,2019-07-02,7.2,47,10.815,"A girl inherits a miniature horse that develops an unlikely friendship with her half-sister's Jack Russell Terrier, who takes to riding on the horse's back.",10751,False,/2zE0W5HpkU9fQEpzKNAmlybNCgk.jpg,/2RNTzbWcvuaDLfzYSF5vMgeJuQQ.jpg,2019,7,2
599484,Hell Girl,en,2019-04-02,5.7,45,10.809,A demonic creature not of this world impregnates a woman. 160 years later a team of ghost hunters must set aside their quick buck party mentality when they discover one of their team is the offspring of the entity haunting the place - and its true target. The offspring and her friends become uneasy allies with the ghost of the mother to destroy the demon and restore harmony.,27,False,/sfsP1rCgPhyFkRnuxhPS92TXV0t.jpg,/ku33DN2nw0LvdapeA6g6QTV7BgM.jpg,2019,4,2
601993,Young Aunt,ko,2019-05-14,10.0,2,10.795,"In an ordinary-looking house, live the owner couple, Se-kyung and Jung-sik, their daughter,Ma-ri, and Jin-seong who's new to society. The couple is on vacation, and Ma-ri and Jin-seong are alone in the house.  One ordinary day, An Uninvited Guest called Soo-jeong comes along. She had a fight with her husband and had come to stay in her brother's house for a few days. However, one night Soo-jeong gets drunk and mistakes Jin-seong's room for hers. As a result, they end up sleeping together. Ma-ri sees Soo-jeong come out of Jin-seong's room, but suspects nothing else.  Vegetarian Jin-seong craves sex and sleeps with Soo-jeong once again. However, Soo-jeong goes back to her husband, and Jin-seong can't help but feel lonely.  Meanwhile, Ma-ri likes Jin-seong and seduces him to have sex with her, but she's outraged when he tells her he had sex with her aunt.  This is the story of the ordinary but not so ordinary, secretive house.",10749,False,/yfzB0dXwz0F2T3f4LVuLqVowC5i.jpg,/cx0Fiv5sBp1NDI1Wqak1UCM6Kyy.jpg,2019,5,14
559401,Sibyl,fr,2019-05-24,5.7,452,10.77,"Sibyl, a jaded psychotherapist, returns to her first passion: writing. But her newest patient Margot, a troubled up-and-coming actress, proves to be a source of inspiration that is far too tempting. Fascinated almost to the point of obsession, Sibyl becomes more and more involved in Margot’s tumultuous life, reviving volatile memories that bring her face to face with her past.",18,False,/po4p0AfL0NrjQ5S219L6XOEUywn.jpg,/9W4pznUF8Np6qHExgclaRHVHzom.jpg,2019,5,24
527385,After the Wedding,en,2019-08-09,6.373,232,10.77,"Seeking funds for her orphanage in India, Isabelle travels to New York to meet Theresa, a wealthy benefactor. An invitation to attend a wedding ignites a series of events in which the past collides with the present while mysteries unravel.",18,False,/ofPRKAHbAhKHzo1mjOACLZDdMaF.jpg,/cyFbVSajl1NGwBJdW0xOyvh9t7G.jpg,2019,8,9
492002,Radioflash,en,2019-11-15,5.154,78,10.759,"When a nuclear strike causes an electromagnetic pulse that cuts off all power, water, and communication to the entire western United States, Reese finds herself plunged into an all-too-real fight to survive. As pandemonium grips her city, Reese and her father set out on a desperate journey in search of safety--a perilous trek through a world gone mad where every encounter with a stranger could be your last.","53,18",False,/fhz01EmeE1aTsqCFvX50hGmFdv5.jpg,/z7RNOII2gXkZugOf7TjsISoLYRl.jpg,2019,11,15
455957,Domino,en,2019-05-31,4.6,269,10.75,"Seeking justice for his partner’s murder by an ISIS member, a Copenhagen police officer finds himself caught in a cat and mouse game with a duplicitous CIA agent who is using the killer as a pawn to trap other ISIS members.","80,53",False,/oVW0qhssm5NsOqTEJgO9DRH2lYT.jpg,/4ExrDZRhhmZkveXMjUzywc6266q.jpg,2019,5,31
510284,Braid,en,2019-01-10,5.8,152,10.749,"Two drug dealers on the lam seek refuge inside their mentally unstable friend’s mansion. But in order to stay, they have to participate in her elaborate, and increasingly dangerous, game of permanent make-believe.","53,27,9648",False,/lZiV30y7TUDNgY2LzNMOWiy8wQv.jpg,/sp8dzGdwBh3cDU8ygyjtoejfZzI.jpg,2019,1,10
599399,After We Leave,en,2019-05-20,5.5,25,10.746,"A sci-fi drama about a man struggling to find his wife, who he abandoned six years ago, before their visa to emmigrate to an off-world colony expires.","878,18",False,/mjsifKZI5gFXFp3v8RQTMAZdefP.jpg,/mE2WdHdIwPdnOpfrswpvm6ZyKJu.jpg,2019,5,20
586451,Blow the Man Down,en,2019-04-26,6.219,295,10.746,"While grieving for the loss of their mother, the Connolly sisters suddenly find they have a crime to cover up, leading them deep into the underbelly of their salty Maine fishing village.","18,9648,35",False,/fsM6AB85cptuiG142s6ZQS17mjr.jpg,/AgxDU9Vp0R6RIV6jpmQ4JrTcZzv.jpg,2019,4,26
522464,Palm Beach,en,2019-08-08,5.3,28,10.741,"A group of lifelong friends reunite to celebrate a special birthday, with Sydney's iconic Palm Beach providing a stunning backdrop for the unfolding drama. The good times roll, with loads of laughter, lavish meals, flowing wine and fantastic music, but slowly tensions mount and deep secrets arise.","35,18",False,/6Usz16UMgOoObQNEUKigNhRyG0x.jpg,/g210Wx9Imdg4jpgPJgr2Rov30pe.jpg,2019,8,8
496967,Atlantics,fr,2019-10-02,6.8,252,10.721,"Arranged to marry a rich man, young Ada is crushed when her true love goes missing at sea during a migration attempt — until a miracle reunites them.","18,10749,14",False,/sopMsXMsgGLP3PnDwAO5NLuUKeO.jpg,/zRnZM6HqglFK31MYyrTSQVlj1dQ.jpg,2019,10,2
526426,Made in Abyss: Journey's Dawn,ja,2019-01-04,7.8,50,10.71,"First compilation movie of the TV series which covers episodes 1-8 with new scenes added for the introduction. It covers the period from when Riko descends into the Abyss with her robot companion Reg, reaching the second layer where they meet the White Whistle Ozen who reveals information about Riko's mother.","16,12,9648,14,10751,878",False,/lgwoOS8uYQ9iBneUI3ynd5mE9Uj.jpg,/exLf3eUR7705XwNYR6HFZAMObSR.jpg,2019,1,4
340268,State Like Sleep,en,2019-01-04,4.9,32,10.71,"Following the death of her husband, Katherine travels to Brussels, where a few loose ends become a whole web of secrets as she untangles her late spouse’s mysterious last days alive.",18,False,/kyAkx3ayBauxZcfZWHfkdvvpesn.jpg,/m3j0RJacytPtwzVSL6n7mqZDa9R.jpg,2019,1,4
619441,Goodbye,es,2019-11-22,7.1,214,10.706,"Seville, Spain. Juan Santos, a convicted petty criminal, gets out of jail for a day to celebrate with Triana, his wife, the first communion of their daughter Estrella.","18,53",False,/A1Cyp3iNv4fjV4HZ6tvc0GEHQ9c.jpg,/tzr7XZNEq6zwgBVQzrrEHieOUI2.jpg,2019,11,22
590102,Love Takes Flight,en,2019-04-27,7.5,35,10.69,A workaholic hospital director is forced to re-examine her rigid lifestyle when a free-wheeling EMS pilot enters her life.,"10770,10749",False,/lnFkyyTOYk2STRdJjUimKPUE8QS.jpg,/tOCjOGMcmsDF2Ylsh61hP3YnG9p.jpg,2019,4,27
594404,Leaving Neverland: ProSieben Spezial,de,2019-04-06,6.1,116,10.683,"The world is talking about 'Leaving Neverland. In our ProSieben special, we ask questions that the documentary doesn't, and look at the most important moments in the life of the superstar. In addition, we explore the question of how the new allegations change the view of Michael Jackson's overall work. This helps to classify the special documentary 'Leaving Neverland'.",99,False,/yYUk8kiD1m8v10ia6v5SrhKVDqY.jpg,/nxKsaLxUk8twCYSDp6nAaU0SMrW.jpg,2019,4,6
498743,Never Grow Old,en,2019-03-15,6.0,208,10.676,"An Irish undertaker profits when outlaws take over a peaceful town, but his own family come under threat as the death toll increases dramatically.",37,False,/46FU4EWeSwgdvWMZIEUaJoLvkYP.jpg,/3WGh8RtXOCG6Onrju1SBO67fCGb.jpg,2019,3,15
656268,Good Mom's Friend 3,ko,2019-10-28,5.2,3,10.662,Sexually oriented film about the sexual intercourse between son and lender for paying down debt,"18,10749",False,/23ydkA19dACF2RuvxenwaUshXIe.jpg,/jxJVsiRtuJPyzn7XkN5Ns0wH4Ks.jpg,2019,10,28
647498,1942: Unknown Battle,ru,2019-12-05,7.7,154,10.656,"WWII 1942: Rzhev, USSR. Stuck in a crucial strategical position, a small company from the Red Army does whatever it takes to fend off the Nazis.","10752,18,36",False,/zZpWJh5kiYapUdMcSp6mkHTL3RQ.jpg,/k0dKShTvJZdqkwzJ4qqloy2nNFP.jpg,2019,12,5
624932,Dave Chappelle: Sticks & Stones,en,2019-08-26,7.619,308,10.651,"Dave Chappelle takes on gun culture, the opioid crisis and the tidal wave of celebrity scandals in this defiant stand-up special.",35,False,/qs4YtPoCTLiv9V2w8oaAOAliF6W.jpg,/hsyPTPoFDhUw5aGcj7dxAx3i1Qp.jpg,2019,8,26
601434,Mayday Life,zh,2019-05-24,7.7,6,10.648,Mayday Life Tour is linked by four distinct segments and the story is unveiled in “Yesterday’s Rumbling Fun”.,10402,False,/c4mmBSIZzbiCi1f3SX4j5w6bOLM.jpg,/7TJBERBpHDksMzvTih7VMvG5ma3.jpg,2019,5,24
516700,Gundala,id,2019-08-29,6.236,316,10.648,"Sancaka has lived on the streets since his parents left him. Living a hard life, Sancaka survives by thinking about his own safety. When the condition of the city gets worse and injustice rages throughout the country, Sancaka must decide whether he continues to live to look after himself or rise to become their oppressed hero.","28,12,878,18",False,/9Y7oAd9P4l6TWVmeYD4hydxNJ6v.jpg,/wZCo5qUz3IdIhs6466B9PpFglXU.jpg,2019,8,29
561974,Dino King: Journey to Fire Mountain,ko,2019-12-25,7.8,112,10.646,"Speckles, a ferocious tarbosaurus and his young son junior, mourning the loss of their family in an epic battle, roam the lands in search of food, adventure and peace. Under the watchful eye of his dad, Junior is growing up healthy and strong, but with an overconfidence thanks to his young age. After one encounter results in Junior being kidnapped, Speckles embarks on an adventure to the ends of earth to find his son. Encountering friend and foe, ally and enemy, Speckles will stop at nothing and will take on all corners to save his offspring.","16,12",False,/fnA8T8cQKAKq8nlfonyMfJRQrLa.jpg,/w6N6xJvvjY6pLxOnHz5yu9Z8quG.jpg,2019,12,25
348672,About Endlessness,sv,2019-11-15,6.5,177,10.641,"A reflection on human life in all its beauty and cruelty, its splendor and banality, guided by a Scheherazade-esque narrator. Inconsequential moments have the same significance as historical events. Simultaneously an ode and a lament, presents a kaleidoscope of all that is eternally human, an infinite story of the vulnerability of existence.","18,14",False,/dQgqxHUdcNSmhiM4zebekZnnUII.jpg,/fRIBlFJiMNm7DkphQgcHgDS2Pvx.jpg,2019,11,15
652783,Sheep Without a Shepherd,zh,2019-12-13,7.7,83,10.634,"Li and his wife A Yu run a small business in Thailand and enjoy a happy home life with their two daughters. When their eldest daughter is violently assaulted, blackmailed and left traumatised by another student, her parents intervene, leading to a dead body which needs to be hidden, and every trace of the boy buried to cover up the accident.","80,18",False,/kgacyo0eXU22ObxUwZ0lquGNB6I.jpg,/1pjSsjhkv4tiFe2wTE3VPycQY6a.jpg,2019,12,13
567733,Crypto,en,2019-04-12,5.4,193,10.626,A young agent is tasked with investigating a tangled web of corruption and fraud in New York.,"53,80,18",False,/xz5I9tqoSnaauJwNV1zyt17SQTi.jpg,/fzTvnA3buXsjdmjrYRDozKBFF78.jpg,2019,4,12
613853,Venky Mama,te,2019-12-13,3.9,10,10.619,"When his sister and her husband die in a car accident, a rice-mill owner decides to raise his nephew as his own child. They become inseparable over the course of time, but there are evil forces at work that are trying to separate them.","10751,35,18,28",False,/wZyqAWKxhoE6BBsBzgzplF8EwEn.jpg,/jVDv4VWaKdfXiI89fMnNtZI2r3x.jpg,2019,12,13
565716,American Factory,en,2019-08-21,7.176,449,10.61,"In post-industrial Ohio, a Chinese billionaire opens a new factory in the husk of an abandoned General Motors plant, hiring two thousand blue-collar Americans. Early days of hope and optimism give way to setbacks as high-tech China clashes with working-class America.",99,False,/vzmUkbi07g2dKVL6YCr8FX3LFgn.jpg,/7jH3dQOJ3CHMrp9tWsI3rRCDiaD.jpg,2019,8,21
441384,The Beach Bum,en,2019-03-21,5.655,495,10.597,"An irreverent comedy about the misadventures of Moondog, a rebellious stoner and lovable rogue who lives large.",35,False,/doIPeWBY6NYFheKGv6jJ8bV7bez.jpg,/iXMxdC7T0t3dxislnUNybcvJmAH.jpg,2019,3,21
579245,The Specials,fr,2019-10-23,7.836,902,10.589,"For twenty years, Bruno and Malik have lived in a different world—the world of autistic children and teens. In charge of two separate nonprofit organizations (The Hatch & The Shelter), they train young people from underprivileged areas to be caregivers for extreme cases that have been refused by all other institutions. It’s an exceptional partnership, outside of traditional settings, for some quite extraordinary characters.","35,18",False,/580aO5umsOX5FAFmD6ObYvVuk6p.jpg,/zJziqrnSOzKiV0TrNVZ3AS0NMKI.jpg,2019,10,23
545330,Hacker,da,2019-03-28,6.767,120,10.569,"13-year-old Benjamin discovers that his mother didn’t die in an accident as he was led to believe. The trail leads to high-ranking officials in the Danish Secret Service. ""Trust no one!"", he is told.","28,10751",False,/zKPgnVtTxMuVIneBw4rskMXMsQD.jpg,/sJKcpT5LRuCdGpWm29yH2bMWqT0.jpg,2019,3,28
611748,Housefull 4,hi,2019-10-25,5.7,81,10.559,"Three couples who get separated from each other due to an evil ploy, reincarnate after 600 years and meet each other as history repeats itself again and their respective partners get mixed up this time.","35,18,10749",False,/6phj6ztvDBU9Fn6MMONhCpqa6mM.jpg,/aCJOZzWV6cpZ9p9tmfEzXq4EqN8.jpg,2019,10,25
454292,Saaho,te,2019-08-29,5.8,91,10.53,"A battle for power ensues as warring gangters thrive to gain possession of a ""black box"" that can make them richer than they already are, and an undercover cop intervenes with the help of his sharp intellect and an instinct to kill.","28,12,53",False,/3fEP3Qder6MrNj7y2GdlN6BtMPC.jpg,/61KXPWhq3WbzJ01LdYo8wdQ1ONz.jpg,2019,8,29
647117,Condition of a Mom: Sugar Mom,ko,2019-08-06,0.0,0,10.507,"It's hard to believe Hee-jeong is old enough to have a son (Seong-bin) in university. She needs some kind of stimulant in life, so she starts meetings under conditions. Yeon-hee, Hee-jeong's friend who runs a café, is a killer for younger men. Hee-jeong sends her son Seong-bin to work in Yeon-hee's café... Yeon-hee thinks of her friend's son as meat... Hee-jeong ends up meeting with her son's friend and fate decides to play a game.","18,10749",False,/e9HZroRCbxSA9RSw4KSjZ2FPAft.jpg,/gzokz23PNdln6zf6bwkK2iN6aSF.jpg,2019,8,6
524779,Master Cheng,fi,2019-09-27,7.2,57,10.504,"Cheng, 45, a restaurant owner from China, has travelled with his young son halfway around the world to a remote village in Finland. His wife died recently in an accident, and Cheng wanted to have a break from everything by traveling with his son to see an old Finnish friend who lives on a farm in the countryside of Finland. It’s the most remote place Cheng can imagine with endless forests, thousands of lakes, a country with entire population of one-fifth of Cheng’s home town, Shanghai.","18,35",False,/2gXT7Z0pRXEGUuLtXNiEARe2ocK.jpg,/pXXvSPZ3noWh4M1vw9MbLk9VSCk.jpg,2019,9,27
530723,Bad Education,en,2019-09-08,6.742,664,10.497,"A superintendent of a school district works for the betterment of the student’s education when an embezzlement scheme is discovered, threatening to destroy everything.","18,80,36",False,/kriOlxu4KVEjd0ZaY3dW7YYyP4z.jpg,/gizz5FphOtfSnLaGpRALOZgILd5.jpg,2019,9,8
