id,title,original_language,release_date,vote_average,vote_count,popularity,overview,genre_ids,adult,backdrop_path,poster_path
768957,Asura Bride,zh,2020-11-26,4.0,2,5.235,"On the night of her wedding to General Xiao Kian, princess Wang Xuan transformed into a ghostly Asura Bride, killing and destroying every guest, even the three princes. Ziheng, who was a childhood sweetheart, were terrified. However, Xiao Ji did not leave him, and together with Wang Xuan to find the truth, he did not expect to involve a bigger conspiracy behind him.",53,False,/4MgEqbdZ4fs9gyeJ8ZsAVXAtfXO.jpg,/q6JN2CQDWtw1OUCCgKKHXgKFG9j.jpg
720716,Three Delicious Sisters 2,ko,2020-05-09,0.0,0,5.219,"Three sexy sisters and one man's cohabitation! Fun to choose~ Who will you enjoy with tonight? Jiyun, Jisoo, and Jiyoung go on a trip and only three sisters remain at home. It's scary because it sounds like a strange sound comes from the house on the first night. At that time, the youngest, Ji-young, says she has a reliable brother who fights well, and she invites Minsu to propose to live at home until her parents come. Min-soo, who came to her three sisters' house, enjoyed her first time with her secret sex with her sisters. Even at first, secret sex with the sisters was good, but the body and mind are getting tired of the sisters' desire to become stronger.","18,10749",False,,/kh0z5P8L0gseMYGbNM8QobVKejd.jpg
566656,More Beautiful for Having Been Broken,en,2020-05-08,6.8,35,5.215,Three women’s lives intersect at a lakeside resort and are forever changed by the love of a special needs boy.,18,False,/cC9Y1Z2D9yonF30NdVWRJJPI8VI.jpg,/lfxGRXKh80W9LLUVNKvrCL5uCEN.jpg
700567,Young Older Sister-in-Law 3,ko,2020-01-09,1.2,2,5.214,"Seong-hee and Hyeon-hee are sisters. However, these sisters have many secrets. One secret is that the older sister, Hyeon-hee, is having an inappropriate affair with her sister's husband. Seong-hee knows about her sister and her husband, and is having an affair with her sister's boyfriend. Another secret of theirs surfaces...",10749,False,/l5QIdMqvmQj3h1memAOlC91oRC8.jpg,/2RwyJMFy5DMaMB6fxQNJso09koq.jpg
751267,Accomplice,en,2020-07-08,7.6,21,5.213,"It’s a moment time-stamped in our brains. Maybe it was a birthday gift. Or perhaps you saved paycheck after paycheck to finally purchase one. However you met your first bicycle, it was the pedal strokes that came afterward that hooked you onto something intangible. Adventure. Connection. Freedom. From the producers of UnReal and the director of Where The Trail Ends comes Accomplice, an homage to all the crazy adventures and crazier comrades that result from our finest sidekick. On the surface, Accomplice takes you to mind blowing locations across the globe with the world’s top riders. But beyond that, Teton Gravity Research’s latest film celebrates how the bicycle is more than just a mode of transportation - it’s a vehicle for the human spirit.",99,False,/as2mFn1iLDECZscrhWgoqtOubIt.jpg,/1S9jXlNiamObi1esuBgImbOhsEB.jpg
680716,Sister's Diary,ko,2020-02-20,9.0,2,5.21,"Ga-eun and Su-ho grew up like brothers and sisters.  However, Su-ho never showed that he likes Ga-eun ever since they were young.  One day, Suho accidentally found Ga-eun's diary and found out that she also likes him.  Su-ho reveals his feelings to Ga-eun.  Ga-eun is not his real sibling, but to protect their parents, she rejects him...",10749,False,/Ukp1n6RVn9bQTM96soYvRh2vVQ.jpg,/hegMq2VBr7QVdUXZFKvhaYQzCEY.jpg
659290,The Ties,it,2020-10-01,6.7,167,5.206,"Naples, early 1980s. The strained marriage between Aldo and Vanda is fractured one evening when Aldo admits, unprompted, his infidelity. Equally hurt and bewildered, Vanda attempts to hide her pain from the couple's two school-age kids, lest they discover that their cramped apartment is not a home of trust and love. 30 years later, Aldo and Vanda are still tied together, but their relationship with each other and their children continues to be defined by what happened all those years ago.",18,False,/vBwpFKgAXWkXBm7IaGf3445u5nY.jpg,/sdxSGa9cqsvlOZuvRtcH2Nu0ebE.jpg
651135,The Big Step,it,2020-08-20,6.8,82,5.199,"At the age of six, Dario watched the first moon flight on television. Since then, his dream has been to fly to the moon. For the past three decades, the ingenious but difficult by nature Dario has been building a moon rocket on his farm in the Veneto countryside. Rocket technology represents applied rocket science. Its systems are implemented on a do-it-yourself basis, and the components are obtained from the local hardware store. The initial launch of the rocket fails. The neighbor's cornfield burns down and Dario is arrested. When his Roman brother Mario hears about the difficulties that have arisen, he goes to his aid and Italy's secret space program finally gets going.","878,35",False,/1MTGGs5zYva7MDR5MtJrDnEBqZ8.jpg,/exU8POhJJHrM5nL2zcmY8JWvltn.jpg
722796,The Town of Headcounts,ja,2020-09-04,6.3,3,5.193,"Pursued by loan sharks, Aoyama is rescued by a mysterious man in orange overalls, and spirited away to “The Town,” where other dropouts hide out from debtors, abusive partners or the police. It’s a perpetual holiday resort where every need is catered to but hidden in it is a sinister conspiracy.","18,9648,878",False,/zIfgvS1yJrPckF1GRDwGWkMtIm3.jpg,/jVTq2lItcd98DQVcVnphr9B8Ynv.jpg
746035,The Christmas Ring,en,2020-11-07,6.788,33,5.19,"A reporter searches for the love story behind an antique engagement ring. With the help of the ring’s owner’s grandson, they learn the legacy his grandparent’s left behind.","10770,10749",False,/vaOSSxnkr6ecBFAqwHKBrrk6BIy.jpg,/qG6kfgzZyekumMjM9oxRNNIeYoL.jpg
613361,L'Esprit de famille,fr,2020-01-29,5.5,54,5.19,"A writer must face the sudden death of his father, but after the burial, the latter reappears to him. He will have to learn to live with this facetious companion, but difficult to explain the situation to his family, because he is the only one who can see him. This disturbing presence will create an earthquake in the family.",35,False,/iZzP18E8JUToGsWKEhVBB5v57GY.jpg,/9UIF5w5tYEicBnrQ8hNr1RR4NYc.jpg
616331,Adolescents,fr,2020-09-09,7.3,88,5.18,"Emma and Anaïs are best friends and yet everything in their life seems to set them apart, their social backgrounds but also their personalities. From the age of thirteen to eighteen, Adolescentes follows the two teenagers during these years where radical transformations and first times punctuate daily life. Through their personal stories, the film offers a rare portrait of France and its recent history.",99,False,/rB8OXmNpLpWUHD9YmKUMQGI5vcF.jpg,/l0oC8bHtFtIMFIbE59l09OIDP3z.jpg
676839,Human Animals,es,2020-12-12,6.9,69,5.177,The harmony of a seemingly idyllic neighborhood is disrupted when a dog attacks a young girl.,"18,53",False,/5eh3FcbEEK9jyoZr6CApEFwvlwU.jpg,/5Ba51RwONmbrotqX1FgHELYtffU.jpg
671074,My Wife's Lover 3,ko,2020-01-10,0.0,0,5.177,"Kyung-soo and Eun-ji are married due to their parents' business. Eunji is sad and depressed because her husband's love is not married. Meanwhile, Gyeongsu meets Yeongju without a wife and has an affair. One day, Eun-ji's boiler broke down at home, and she called an AS engineer. He meets Jung Hwan, who was a lover before marriage. The husband goes out of the hotel saying he sleeps at the hotel until the boiler is repaired, and Eunji and Junghwan get hotter after thinking about it...",10749,False,,/lLgkLDjJ2h4RGI7BIDnYzV2Q7Hs.jpg
589972,Little Vampire,fr,2020-10-21,6.9,36,5.176,"Little Vampire lives in a haunted house with a merry group of monsters, but he is bored stiff! One night, he secretly sneaks out of the manor along with his trusted bulldog, Phantomato, on a quest to find some new friends.","16,10751,14",False,/dAWrub4aTNMsh0pnYBiGPKZiREr.jpg,/mLd9FVJTwnPO3ERv82ea5IZo6Hl.jpg
809576,The Shortest Distance is Round 3: Fallen Flowers,ja,2020-11-06,4.5,2,5.174,"Haruto and Aoyama, once a couple, are now completely without contact. As Aoyama's secrets are gradually revealed, Haruto, now the shop manager of an underground escort club, is starting to question whether the man he loves is worth the wait; his feelings for escort Ruka has also evolved from mere compassion into something more. A mystery sex toy links the past and now of Aoyama, Shibahara, Ruka, and Haruto. A sudden murder then happens in 'Rain& Soda' as one of the escorts serves a customer. The murder horrifies the club, and the truth is soon to be brought under the light of this sensual world of sultriness.","18,10749",False,/kAzBvgFbsmrGUNJ4v3fuqvS9MC1.jpg,/sijMwmKCyJlJJcOdDoiAtRZXPAi.jpg
706518,Business Trip Massage: Excited Ladies 2,ko,2020-05-14,0.0,0,5.172,"Myeong-jin and Hee-seok works as masseuses for men on business trips. With the difficulty of handling the growing number of clients, they attract Jin-goo, a young man they know with the nickname 'stud'. Young-blooded Jin-goo instantly captivates customers, and Myeong-jin and Hee-seok also surrenders their bodies to the flames.",10749,False,/3X5P8SamDcfKZX08k8THwAiXDpm.jpg,/35yiRmOeFxnD9rJUJ86JXDpwp11.jpg
655424,The Snail and the Whale,en,2020-10-21,6.35,40,5.156,"A half hour animated film for all the family based on the much-loved book written by Julia Donaldson and illustrated by Axel Scheffler.  The Snail and the Whale is the much loved classic that shows us a restless young snail who has ambitions to travel the world. The other snails think she should stay put, but she puts out a call for a “Lift wanted around the world”. Eventually her call is answered by a great big grey-blue humpback whale! She sets off with him across the seas. On their journey the snail and the whale discover towering icebergs and far-off lands, fiery mountains and golden sands. The snail is delighted by the wonderful world around her, until she realises how small it makes her feel.","16,10751",False,/nLMA7qSV14WBiNZQFvvkhFnyysF.jpg,/qWsqdJ6XUvwimqxwlplIazKjpve.jpg
659699,Delete History,fr,2020-08-26,4.9,221,5.145,"In a provincial suburb, three neighbours come to terms with the consequences of the new world of social media. Marie, who lives off her husband’s family allowance, is afraid of losing her son’s respect because of a sex tape. Bertrand can’t say no to advertising calls and is fighting to protect his daughter, who is being bullied online. Christine, after losing everything because of her addiction to TV series, wonders why her rating as an Uber driver is not taking off. These three lone fighters are incapable of finding a solution to their problems on their own — until they join forces to declare war on the tech giants.",35,False,/ifiw0r2wMSP8ERz7QcJwJV5wHJ.jpg,/5JXC451k9TD9zE4FSrASv66MowV.jpg
679888,Rosa's Wedding,es,2020-08-21,6.214,84,5.139,"Rosa is about to turn 45 and realises that she's always lived her life to serve everyone else. So she decides to leave it all behind, take charge of her life and fulfil her dream of starting her own business.",35,False,/jp3LfaGGkXXS9Fq6361IzKoIy8v.jpg,/bdy9e0cdq83szB07rHbiG4kokEg.jpg
653579,Welcome to Chechnya,en,2020-01-26,7.0,44,5.138,This searing investigative work shadows a group of activists risking unimaginable peril to confront the ongoing anti-LGBTQ program raging in the repressive and closed Russian republic. Unfettered access and a remarkable approach to protecting anonymity exposes this under-reported atrocity–and an extraordinary group of people confronting evil.,99,False,/csuz4zkcyckKn5dVVRkOhCmkWJs.jpg,/wR1b8w3fFPQR5wpbkekviLmo4wW.jpg
579400,Stardust,en,2020-12-04,3.9,34,5.136,"David Bowie went to America for the first time to promote his third album, The Man Who Sold the World. There, he embarked on a coast-to-coast publicity tour. During this tour, Bowie came up with the idea of his iconic Ziggy Stardust character, inspired by artists like Iggy Pop and Lou Reed.","10402,18",False,/md5KiBEC3D9vszDka53uroJT9ak.jpg,/woOQx1s4mNVAprRpky3ntRgdlf4.jpg
641483,Holly Slept Over,en,2020-03-02,5.7,43,5.131,Audra confesses to her husband Noel that she had a lesbian fling in college with her roommate Holly. Things turn upside down when Holly visits their house and Noel suggests the idea of having a threesome after getting the idea stuck in his head from his friend Pete.,35,False,/pvx0FcXzFc47VfaPuIrFC8Oolc6.jpg,/pQt9IC25jeJ0r1T4q6i29qDca3y.jpg
669525,Night on Earth: Shot in the Dark,en,2020-01-29,5.9,12,5.13,"This look behind the scenes shows how worldwide camera crews climbed, dived and froze to capture the documentary's groundbreaking night footage.",99,False,/a28Vi0giqvzwzURhKBHxaUtz517.jpg,/baEhAWjyazKnvteIeO4HQskN3yj.jpg
614764,My Name Is Sara,en,2020-02-27,7.0,22,5.127,"The true life-story of Sara Góralnik, a 13 year-old Polish Jew whose entire family was killed by Nazis in September of 1942. After a grueling escape to the Ukrainian countryside, Sara steals her Christian best friend’s identity and finds refuge in a small village, where she is taken in by a farmer and his young wife. She soon discovers the dark secrets of her employers’ marriage, compounding the greatest secret she must strive to protect, her true identity.","36,18",False,/4WdDl4OOWbyxCHbHIg2gP992F5D.jpg,/ytazXDPHkEpIXYjaIBSaaQeoi5x.jpg
677113,Brother's Girl,ko,2020-02-20,0.0,0,5.126,"Ki-joon, who lived alone with his younger brother Sang-woo, is worried about Hye-ran, who was the mistress of his father who died in an accident not long ago. Hye-ran had no place to go since their father’s support had been cut off. She had no plans to move away and Sang-woo is into her. Meanwhile, Hye-ran is not satisfied with her sexual relationships with Sang-woo and she is worried about Ki-joon’s mind.",10749,False,/wWtsvqzLhL1SV0aJIStb6MmGJTW.jpg,/xyqmBhyNVZnTfsKlkoMpIyoKWy1.jpg
663451,Magic Arch,ru,2020-10-01,6.7,31,5.125,A young dolphin with an active imagination saves Fish Town from evil Moray Eels and reunites with his father after discovering a magic arch that makes wishes come true.,"16,10751,14",False,/nwvsWuHB2ZHSQ3stTV7p4thkQOn.jpg,/hnDhw5nudk4RfiV1Fxn3QXV3HuJ.jpg
729779,The Way I See It,en,2020-09-18,7.7,28,5.124,Former Chief Official White House Photographer Pete Souza's journey as a person with top secret clearance and total access to the President.,99,False,/r1BmcsQb41zARDGgRSSP2qRthVV.jpg,/jxbjC3Pzs9WTD7yz7aMMzm6fBIE.jpg
723832,Let Life Be Beautiful,zh,2020-10-05,7.0,1,5.123,"The film was adapted from a real story, that tells a young boy Wang Xinyang's life has completely changed because of sudden leukemia. Facing the unknown tomorrow, Xinyang is still optimistic and strong.",18,False,/jq5fPpE4JyfI6vnYro1xNUoFzCq.jpg,/c6FvXfmbqfITCcoMKmAgloLGVXw.jpg
691100,Ten Minutes to Midnight,en,2020-08-14,5.8,21,5.114,A late night radio host is trapped inside the station by a violent storm after being bitten by a rabid bat.,27,False,/l5rjAaliZH9cZj2yRIE8bUeUJcs.jpg,/k8xmHHVnkb2c52lDVautBEi23jb.jpg
734355,Monster Run,zh,2020-08-18,5.104,24,5.113,"Ji Mo is an outcast, due to her ability to see monsters that no one else can. One day, she meets a monster hunter, Meng. She discovers that there really are monsters in the world, and she is involved in a new storm.","28,12,14",False,/4a5QISRZ6XdyurHAvMdqMbhWfFI.jpg,/18mwyI7hSaXwqfJazyCbCEq4TLl.jpg
696817,Love in the Forecast,en,2020-06-13,6.9,58,5.111,"After swearing off dating for a full year, Leah quickly learns her new commitment has made her a magnet for men.","10749,10770",False,/yrrxAcoO2vRFGt7nLsrxunLMPCX.jpg,/jM2D5NgBvl7ifSJ5PsreYAxO9vA.jpg
676844,The Day of the Lord,es,2020-10-30,6.1,42,5.109,"In this horror movie, a retired priest haunted by his sins is pulled back into the darkness when a friend begs him to help his possessed daughter.","18,27,53",False,/fZb5itrenb5g0QUsTgoDQKYutd3.jpg,/bZQ88XFGKTTrOyeWM7wVKLTuC1N.jpg
638983,Don't Air Your Dirty Laundry In Public,es,2020-04-10,8.0,94,5.107,"Lupita and Toña work as housemaids at the Ruíz Palacio’s house, an aristocratic Mexican family. For a long time they have been mistreated and poorly paid. They’re now fed up with the abuse and lack of respect they get from their employers.","18,35",False,/x6F8PwSN5YUra1KoXII05Cvy9io.jpg,/klmsgJ1gBsZSmeN7JbUcaBy1AAV.jpg
718135,Breeder,da,2020-10-31,5.2,54,5.106,"A renowned health supplement company, run by a ruthless businesswoman, is selecting and abducting young women as part of an experiment bio-hacking babies’ DNA to enable her clients to reverse the aging process. When Mia goes to investigate, she finds herself trapped, branded and tortured in a grim underground facility. Familiar faces start to appear, and she realises that she is not alone in this. Can she somehow find inner strength and escape from the nightmare?","27,53",False,/xqVfmPM0zm9iNX4BuWj22yZl1gX.jpg,/p4RwOjzPQ4lpA4pGll5DKXuGlr3.jpg
683556,We Go in at Dawn,en,2020-03-16,5.9,40,5.106,"When a high-ranking war planner is captured and held in a German prisoner of war camp, a team of specialists take on the dangerous mission of trying to break him out. Trouble is, he doesn't want to be rescued.","36,10752,53",False,/88g65g0Gn96JSXpAqSWAVZvDmCp.jpg,/nQqLA58PeF0ofPzq36lNUFRSzCa.jpg
610908,Limbo,de,2020-02-20,5.3,12,5.102,"When Ana, a young compliance manager, discovers unusually high bills among her company's records, she can't imagine what an avalanche her research will set off. Not only does she cross paths with an aging small-time crook and a Viennese Mafia lord at an illegal bare-knuckle fight, she also runs into Carsten, an undercover investigator. He has long been on the trail of a network of money launderers and now faces a difficult decision — since he knows Ana all too well.","18,53,80",False,/7WN0nkgjPT6PqER6RfpF4yvAEDx.jpg,/esHhcAHPNuGvlvOTQOSCYVKEbo1.jpg
665877,Critical Thinking,en,2020-12-18,6.585,41,5.099,"Based on a true story from 1998, five Latino and Black teenagers from the toughest underserved ghetto in Miami fight their way into the National Chess Championship under the guidance of their unconventional but inspirational teacher.",18,False,/bjLaMtcBxVOqwbaWzuThFwnMnkt.jpg,/l1OR2xTnOOX95KGrS3dm5YQopy5.jpg
765522,Tom Cruise: An Eternal Youth,en,2020-10-05,6.6,20,5.096,"After 40 years, Tom Cruise continues to push the envelope in film. Exposing one's heart to the world through their work is not only risky business, as far as Cruise is concerned, it is the only way to achieve an end that feels complete.",99,False,/9mOXEpXUyzTtmgamjC2jGk3SdNN.jpg,/MQwWS1iBzUkpyjNFV8Je6dFoIU.jpg
535987,Lost Transmissions,en,2020-03-13,5.3,33,5.093,"When an acclaimed music producer goes off his medication for schizophrenia, his friends chase him though the LA music scene to help commit him to a psychiatric hospital, revealing the troubling inadequacies of the mental health care system.",18,False,/SFWJpeYVbex65zEC4Wol5zrXRu.jpg,/8pqvbXqkruyyt1u4TWUtxZw59et.jpg
718389,The Angela Chapters,en,2020-06-08,2.6,7,5.084,"""The series of episodes, or ""chapters, is meant to portray dramatized biographical vignettes of my friends whose experiences and recollections reflect the archetypal character of my movies, the ""lost girl,"" Angela Aberdeen."" - Lucifer Valentine",27,False,/rZukcMIwz8yV44pBU1WIaujyWPC.jpg,/vGx4MWE47KzVPiCgH7nwicuHiXL.jpg
712931,Big Breasts Sister 2,ko,2020-05-14,0.0,0,5.083,"Their neighbors, Young-hoon and Chul-soo, have their first love, Minjung. The innocent glass appears to the two men, and each other's love is mixed. As time goes by, Young-hun finds out that her real love is glass and discusses how to reconcile again. Meanwhile, Chulsoo completes his life in the city and descends to his hometown. Then, by chance, Yeonghoon and Yuri appear in the place of reconciliation, and after seeing such withdrawal, Yeonghoon is very embarrassed and asks why he came back. Cheolsu presents something to Younghoon and Cheolsoo and Yeonghoon Yuri go to Minjung's home, the first love of the two men... The story of the two men and women who cannot see one another begins again.","18,10749",False,,/9ua9QFcnI73Qn7XpiMW7MIt24Pu.jpg
616880,Bhoot: Part One - The Haunted Ship,hi,2020-02-21,5.7,27,5.071,"When an abandoned haunted ship called 'Sea Bird' washes up on the shores of Mumbai, surveying officer Prithvi is assigned to solve the mystery and close the case","27,53",False,/hbVQ8B6k1XyRCa1aGQluyyT4LOX.jpg,/5rSRVvlIlelgKM58MAnnk4FId86.jpg
750276,You Are My Home,en,2020-12-04,6.8,14,5.07,"This drama follows the relationship of a heartbroken woman and a young immigrant girl who has lost her mother at the border, coming together just before Christmas.",10751,False,/8pJEt4xmuSxpGLIroZZq8LMufMC.jpg,/zCwtCgKddO9jwMhWEAoxaJdo8Ba.jpg
702738,"Cryptopia: Bitcoin, Blockchains & the Future of the Internet",en,2020-12-10,6.8,26,5.065,"Cryptopia: Bitcoin, Blockchains and the Future of the Internet takes a deep dive into the crypto ecosystem and blockchain technology to discover the good, the bad and the ugly of this controversial industry, its major narratives, conflicts and the major players behind it. Can blockchain technology be used to create a new, fairer, decentralised and uncensored web3.0 where we can control our data and protect our online identities? Or will the potential be squandered as mega corporations once again compete for dominance in this new field.  With his unrivalled and exclusive access, award-winning filmmaker Torsten Hoffman (Bitcoin: The End of Money as We Know It) takes us on a journey into the heart of this brave new world.",99,False,/SqjaDWXgsYNJpzVEPj1Y2i3erb.jpg,/o3dGOQ5PsfKvtv9ew8Ee3S6A5JR.jpg
662659,Marionette,en,2020-09-28,6.3,59,5.065,A therapist loses her grip on reality when a ten-year-old boy claims he can control her future.,53,False,/cb3xdCXws4OLcXNNqQmZHDfAKCY.jpg,/wNNAGw2TsYW4c3if252c6Il1fEc.jpg
655831,Tarung Sarung,id,2020-12-31,7.4,5,5.06,"Wealthy and spoiled, a young man finds something to fight for when he falls in love with an environmental activist protesting his family's business.","28,18",False,/sBX11tyEPrJ5nFCizG441yYBvvO.jpg,/4QiVtMGmEIzJcA8HAGtgA9lsG0h.jpg
587609,Dear Comrades!,ru,2020-09-14,7.3,136,5.056,"When the communist government raises food prices in 1962, the rebellious workers from the small industrial town of Novocherkassk go on strike. The massacre which then ensues is seen through the eyes of a devout party activist.","36,18",False,/p09OicSi8yLRS0xHq41pTijI4O0.jpg,/ds7T5PEplJQeKzpLWbIvW9xpHX1.jpg
733721,Big Breasted Daughter-in-law,ko,2020-08-07,7.5,2,5.054,"Gyeong-jun and Gyeong-joon promised marriage. The performance, where he didn't have a place to live, went into Gyeong-joon's house. While enjoying her newlyweds a little earlier, Gyeong-jun suddenly says that she has to leave for two months on a business trip. Playing with In-young and Nam-soo, who will become mother-in-law without a husband without even registering marriage, Thanks to Inyoung and Namsu, who treat me kindly, I live well, but as the days go by, I am getting tired of dissatisfaction with playing. With envy at the sex between In-young and Nam-soo, Feeling vulgar to Kyung Joon, who left himself alone In order to solve the desire, he searches for a man through the meeting site.","18,10749",False,/uBsZvHnfDVNcD6fa5pAMFDzWZXJ.jpg,/apbt8hTZ8I9xZ4L48XFHniXPwwp.jpg
624774,Butt Boy,en,2020-08-19,5.2,44,5.053,"Detective Fox loves work and alcohol. After he goes to AA, his sponsor, Chip, becomes a suspect in his investigation for a missing kid. Fox believes people are disappearing up Chip’s butt.","35,53,27,14",False,/gnDnYYaLIMcv4jjJD4dDAsIMAjt.jpg,/3CFazTqK7A05D1Cjtc7TPKR0naw.jpg
736203,Ane Is Missing,eu,2020-10-16,5.4,23,5.051,"The Basque Country, 2009. Lide is a security guard for the high-speed train works, a project that generates social protests in the streets. Coming home after work and partying all night, she makes breakfast for two, but her teenage daughter, Ane, is nowhere to be found. The next day, she’s still not back.",18,False,/xT6Dw5gUHz9I7MBuccuyet4JPa.jpg,/5LYxSzkN3JJcCmlXH6O83NExm7F.jpg
664747,Stolen by My Mother: The Kamiyah Mobley Story,en,2020-01-18,8.1,16,5.044,"At the age of 18, Alexis discovers she was abducted as a baby and the mother she thought was hers is really her kidnapper.","18,10770,80",False,/mqkMTdffjrgzYOunozqebfriBsN.jpg,/9o93aS1yJlIgwV3iJV3kstAmSfW.jpg
762632,The Letter Room,en,2020-06-16,6.7,85,5.04,"Richard, a lonely and well-meaning prison officer, is put in charge of reading and censoring the letters received by inmates.",35,False,/bxoEHZ6ITQES9yzS3w121uHLl5E.jpg,/mdN8AnQxiM97GY6FxkZLQHbDPx7.jpg
758545,S.O.S. Survive or Sacrifice,en,2020-10-28,5.6,18,5.039,"Two sisters living separate lives on different continents are reunited on a Mediterranean Island. The two barely have time to bond and revive family ties as Kate, the elder, meets a group of locals and agrees to an exciting ride on a hot air balloon. But disaster strikes and as the result of a freak accident, the balloon is carried far out to sea. Their cell phones out of range, and the balloon running out of gas, Kate and her friends are battling for their lives. While, back on land, the younger sister, Liz, has become an unwanted ""material witness"" to a crime. Matters then take a dramatic twist, one that will mark their lives forever.","12,53",False,/aFaiZ4m8Jg8IQ7Cuq9yumIDC3Pm.jpg,/cqLekREuHyuX5Xe3wvRnERS8Hia.jpg
598354,Feedback,ru,2020-12-17,6.0,29,5.039,"On December 31, seven friends gather again in a country house to celebrate New Year together, but New Year's Eve is full of surprises ...",35,False,/girRFmoAJs0NQqsF02oL2abcKf8.jpg,/6HFDCwwRjXCRVm1PlWXd7S39SX3.jpg
