id,title,original_language,release_date,vote_average,vote_count,popularity,overview,genre_ids,adult,backdrop_path,poster_path
507729,Marlon Wayans: Woke-ish,en,2018-02-27,6.4,50,10.937,"An American stand-up comedy special starring Marlon Wayans who jokes about racism, hip-hop, gay rights, and raising kids.",35,False,/dTkPB8oenu0zUrcG8fUrtQLr3zB.jpg,/n4LE5FaNvkexps3eDUeLYAuHvBN.jpg
526224,Big Legend,en,2018-07-01,6.2,130,10.912,An ex-soldier ventures into the Pacific Northwest to uncover the truth behind his fiance's disappearance.,"27,28,53",False,/8pEFVCxvD33ew4wslgG2TmJLLFT.jpg,/9D4KB1x4r2D6expRfX5E3ExHKle.jpg
400579,Tully,en,2018-05-04,6.8,1416,10.907,"Marlo, a mother of three, including a newborn, is gifted a night nanny by her brother. Hesitant at first, she quickly forms a bond with the thoughtful, surprising, and sometimes challenging nanny named Tully.","35,18",False,/808PRFyIR04myiBwBuDlZ0DT2DS.jpg,/wDI4YXBXolMYi15Qx2kClvdSERM.jpg
473149,Traffik,en,2018-04-20,6.154,445,10.9,"A couple off for a romantic weekend in the mountains are accosted by a biker gang. Alone in the mountains, Brea and John must defend themselves against the gang, who will stop at nothing to protect their secrets.","27,53",False,/wbk9VvJ8lkUF0ElpfRm3dFIzMJf.jpg,/jwsmeU8mYEP6GpxJ2sbCzc2MQmi.jpg
391710,A Futile and Stupid Gesture,en,2018-01-24,6.5,327,10.888,"In a life full of triumph and failure, ""National Lampoon"" co-founder Doug Kenney built a comedy empire, molding pop culture in the 1970s.",35,False,/tWp1P6tGWSMJfmOZxs65SNV0khX.jpg,/kyHBeRgbbhs7kVrZYblVj9u2Xbd.jpg
529784,A Faithful Man,fr,2018-12-26,5.5,266,10.885,"Marianne leaves Abel for Paul, his best friend and the father of her unborn child. Eight years later, Paul dies and Marianne returns to Abel. However, things have changed for the both of them and feelings of jealousy surround their new relationship.","35,18,10749",False,/2995K991Na0ZDVIohnweSBngSkD.jpg,/l1bHryDSFWgiDbEdTf2H7vQAKCp.jpg
550148,The Body,en,2018-09-21,6.3,110,10.867,"In Los Angeles, on Halloween night, a hitman tries to transport a corpse in plain sight, but people he stumbles upon on the street, believing that his sophisticated appearance is a magnificent disguise, constantly stand in his way to congratulate him.","53,10770,27",False,/txf54dz60Hvb4nETdXY1glKa0tV.jpg,/1ZJkoWMPGpFqdVplXivjQOYEp4H.jpg
511343,Tomb Invader,en,2018-03-09,4.0,54,10.86,"Archaeologist Alabama Channing sets off to uncover the ancient tomb of Quin Shi Haung, which promises riches and answers to family mysteries.","28,12,10770",False,/tQW5cNNclBco7GKINpoBTDweyuC.jpg,/mTz0qaYuXIHBAUiwAqJZQxOgWlZ.jpg
534271,The Cleaning Lady,en,2018-08-24,5.4,125,10.838,"In a bid to distract herself from an affair, a narcissistic woman befriends a cleaning lady with burn scars, but she soon discovers that the scars may be more than skin deep.","27,53",False,/msM3MoeypFhaFhp7MFjQMxqkISe.jpg,/v3nzQHHCaAQUw2hIfzBYktaMzfs.jpg
540841,Vlad the Impaler,tr,2018-11-23,5.9,40,10.821,The true story of 7 oddly dressed fearless men of ottoman army fight against cruel Vlad.,"18,36,10752",False,/B4ZhigHvuOj0LRIbDQBWn7EF60.jpg,/q0Y4m9z6CD1XriNottS6XFwtT21.jpg
526746,The Lost Viking,en,2018-05-28,6.4,153,10.794,"A young Viking called Vitharr arrives in Britain with dreams of conquest and adventure, but when his family and clan are ambushed and killed, he must survive alone in this strange,dangerous new land as he searches for his Uncle's settlement.","28,12,36",False,/sKEqdZ3hhTrWbyWTJstRqVB2PMN.jpg,/9gFHSGKV5EZxJe6d6qsROpAiBgQ.jpg
532638,Open 24 Hours,en,2018-08-27,5.6,134,10.775,"After setting her serial killer boyfriend on fire, a paranoid delusional woman gets a job at an all-night gas station. The isolation triggers her anxiety and hallucinations, with devastatingly gory results.","27,53",False,/qr5IzFiJe1ReXUucIoLUsEJoKhU.jpg,/sH1aoV0lNSJiXVoUs52exYqsjLw.jpg
520736,Loro 2,it,2018-05-10,7.2,369,10.774,"""Loro"", in two parts, is a period movie that chronicles, as a fiction story, events likely happened in Italy (or even made up) between 2006 and 2010.  ""Loro"" wants to suggest in portraits and glimps, through a composite constellation of characters, a moment in history, now definitively ended, which can be described in a very summary picture of the events as amoral, decadent but extraordinarily alive.  Additionally, ""Loro"" wishes to tell the story of some Italians, fresh and ancient people at the same time: souls from a modern imaginary Purgatory who, moved by heterogeneous intents like ambition, admiration, affection, curiosity, personal interests, establish to try and orbit around the walking Paradise that is the man named Silvio Berlusconi.",18,False,/4WdbKzOjaCepV7PEbJpcMhFjcJu.jpg,/alZtZ2cOmSen1CCitIsEA0OMVHz.jpg
512968,Tu mi nascondi qualcosa,it,2018-04-25,5.438,88,10.749,,,False,/yKulUZKSZcZS2c3QjnBKCIo4zWX.jpg,/m7rx6YxAmU7gPUVmxMGX7rN1wUu.jpg
538331,Hello Mr. Billionaire,zh,2018-07-27,6.9,105,10.748,"A pathetic minor league Soccer Goalkeeper was given a task - to spend 1 Billion in thirty days, if successful he will get 30 Billion. However, he's not allowed to tell anyone about the task and he must not own any valuables by end of it.",35,False,/e0WTSvngep4JmbyjVVC91V2MCHW.jpg,/AlvbSlFnAAnE7k3r2INbG5Ydb3K.jpg
502350,The Tree of Blood,es,2018-10-31,6.461,142,10.745,"Marc and Rebeca, a young couple, travel to an old country house that used to belong to their family. Once there, they write the shared history of their roots, creating a huge family tree that harbours relationships of love, heartbreak, sex, madness, jealousy and infidelity, and under which also lies a history laden with secrets.",18,False,/dNtKJW5Ljs0tMXER0k8ij4zupGJ.jpg,/z3GhO9usvGOkGm9Okiym8RyET8t.jpg
447856,Pad Man,hi,2018-02-09,7.4,203,10.732,"Upon realizing the extent to which women are affected by their menses, a man sets out to create a sanitary pad machine and to provide inexpensive sanitary pads to the women of rural India.","35,18",False,/A3xIs6QYgOOiOK0vqT7boxlAJll.jpg,/kHyoFs6BIJJwCaFlWu6P5Bnpa70.jpg
456750,"Game Over, Man!",en,2018-03-23,5.485,910,10.731,Three friends are on the verge of getting their video game financed when their benefactor is taken hostage by terrorists.,"28,35",False,/inhn4rTCAhvnu9yR5Kl1ZCRjBki.jpg,/58BnnYeQOTzdMBghZIH1tSH0REx.jpg
460399,"Love, Chunibyo & Other Delusions! Take On Me",ja,2018-01-06,7.8,102,10.719,"Yuuta and Rikka are in their third year of high school. One day in Spring, Touka declares that she will take Rikka to Italy with her, as her job has stabilized there and thinks they should migrate together as a family. Touka is also worried about Rikka not being competent enough to advance to universities in Japan. The gangs from the club suggested Yuuta, who doesn't want to be separated, to elope with Rikka!! A runaway drama throughout Japan begins.","16,35,14",False,/m5DxRZhJO7aluDyHW40M8cEBZAv.jpg,/grlNqxlne3pRBB5kvEc2aHtrSKv.jpg
520440,Unbanned: The Legend of AJ1,en,2018-04-22,6.8,5,10.71,"Unbanned explores the dynamic life of AJ1 from its unlikely origins to its role in disrupting NBA rules, birthing sneaker culture, and influencing a social and cultural revolution. This is the story of a shoe that changed the world.",99,False,/nIWIVgGfqmmlZ8bqrUKG5VYnNsM.jpg,/u0gL9o1b3kgxPVHX8W4DnUR3l8P.jpg
513574,Battle,no,2018-09-28,6.37,642,10.686,"Amalie is the girl who has everything, good looks, money, a boyfriend and a big talent of dancing. One day, her world falls apart and she moves from everything she knows. Then enter Mikael. He is dancing in the streets and Amalie joins him in dancing on the streets, dancing Battles.","18,10749,10402",False,/xFSP8HipmNVCgTISXF5JypQtSQz.jpg,/zfGhtAX7xe7W0ZgEcM2n6tnxgc0.jpg
520409,Royally Ever After,en,2018-05-19,6.179,53,10.678,"Sara's dream of finding the perfect mate is realized when boyfriend Daniel proposes marriage, but there is one tiny hitch. It turns out he is the real-life prince of a small European monarchy, and his marriage requires the approval of his royal parents. Commoner Sara will have to do more than simply impress the in-laws-to-be. If she wants to become Daniel’s wife, she’ll have to prove she’s got all the makings of an honest-to-goodness princess.","18,10770,35,10749",False,/7ZRmCE1czme8FjK23JIOFkohSxI.jpg,/1k5HpDPTWGIh24cvW5wQmV7YOuP.jpg
533592,Scooby-Doo! and the Gourmet Ghost,en,2018-08-28,8.1,161,10.677,"The Scooby gang visits a culinary resort run by Fred's uncle, Bobby Flay. While enjoying the sights, a ghost attacks the guests and destroys the resort, leaving the gang to put a stop to its threat.","16,12,10751,35",False,/ySEZExyAwNJN3iCSdHxNsHelLAU.jpg,/AtHngeqD4K1Oj01ulWc1aDJhU8H.jpg
535692,My Masterpiece,es,2018-08-14,7.3,179,10.653,"Arturo, the successful owner of an art gallery, and Renzo, a talented but decadent painter, are old friends who cannot stop bickering. One day, Arturo comes up with a solution to all their problems, but the plan they concoct turns out to be crazier and riskier than they originally expected.",35,False,/vHJCRXpdNfYePNPm913zglMVlA4.jpg,/lYlCD0fyYlKHQytjsWhFZivaNE1.jpg
525200,The School,en,2018-10-04,4.6,35,10.653,"When a doctor looking for her missing child awakens to find herself in an abandoned school, she must survive the supernatural terror and face her own demons if she is to find the truth about where her son is.","53,27,9648",False,/25yuDMN1RGClKz52eeO4PcPF4PR.jpg,/38GDdvmKhN9DYrGtaQ6OQr53Tnh.jpg
523281,Hotel Gagarin,it,2018-05-24,6.229,133,10.648,"An highly heterogeneous group of people go to Armenia to make a movie, all ignoring what will happen to each of them.",35,False,/oMgfb6tsU5UGKCyW5iDEwip9l40.jpg,/sTo6Gh63waRRV8bw058qKlvt1W7.jpg
700206,An Affair: My Friend's Mother 2,ko,2018-04-09,1.0,1,10.645,A son invites his friend over to take care of his mother and lines are crossed that shouldn't be..,10749,False,/nnJTCmOU6IRNsaDrbUT4hOWZvIk.jpg,/36naI0khmIdxd4JFcH4Ir4eAlZf.jpg
437380,The Skin of the Wolf,es,2018-03-09,5.4,135,10.632,"Martinón is the last inhabitant of Auzal, a village in the mountains where he lives in communion with nature. He only goes down to the valleys twice a year to trade and to buy provisions. But one day he’s convinced to take a wife, a decision intended to soften his calloused soul—but in some ways his real struggle is only just beginning.","10749,18",False,/1bcw9zaXVLgsoyvoR9sksDMg52l.jpg,/iPwqpdpyYz2LGw5oU1DczGrNi2.jpg
479040,Acts of Violence,en,2018-01-12,5.6,406,10.618,"When his fiancee is kidnapped by human traffickers, Roman and his ex-military brothers set out to track her down and save her before it is too late. Along the way, Roman teams up with Avery, a cop investigating human trafficking and fighting the corrupt bureaucracy that has harmful intentions.","28,80,53",False,/pNsRxhhO7TZ7MMYk44anDVJ3eAG.jpg,/pK9CugRd3DIP0THBH8WlGrvk5vy.jpg
512236,Chuck Steel: Night of the Trampires,en,2018-06-12,7.237,19,10.599,"It's not 1985 anymore...it's 1986, and Chuck Steel is 'the best God damn cop on the force' according to his long suffering boss, Captain Jack Schitt. But even this maverick, renegade, loose cannon, lone wolf, cop on the edge, who doesn't play by the rules has his work cut out when the Governor of LA decides to reduce the licensing hours for clubs and bars triggering a sudden, inexplicable spate of high profile disappearances in the city. The disappearances all have the same thing in common, a crime scene covered in blood but with no sign of the victim. The police are perplexed until they get a break in the case when one of the victims manages to escape. Chuck goes to interview the victim at the hospital but is confronted by a crazed old man who introduces himself as Abraham Van Rental. He warns a disbelieving Chuck that an evil scourge is about to descend on the city of Los Angeles - the scourge of the TRAMPIRES - a mutated hybrid of vampire and tramp.","16,28,35,27",False,/jp0pwahviZdvvsDaFWC9DxDflmV.jpg,/lLqvs49ABhfqbaiWsSqKRvOFt8A.jpg
422619,Jonathan,en,2018-11-08,5.84,184,10.598,"Jonathan is a young man with a strange condition that only his brother understands.  But when he begins to yearn for a different life, their unique bond becomes increasingly tested.","18,878",False,/dCSmuAoO7NMkDkkuMQA0J48Ba9E.jpg,/nTd0PBJkA1HLM9yImDnRZDzGAwb.jpg
510338,Dry Martina,es,2018-06-21,5.7,27,10.588,"Martina was a famous singer in Argentina during the late 90s, who's become completely frigid and disenchanted with love. The arrival of a so-called sister, alongside her attractive boyfriend, compel Martina to go to Chile with one objective in mind: getting back her libido.","35,18",False,/rvSBEspGc899mUikZXDAodQBg4c.jpg,/gA6nTGlDtFdRtGEYHSEBzSJ1Xzy.jpg
401545,Everybody Knows,es,2018-05-09,6.518,961,10.582,"Laura, a Spanish woman living in Buenos Aires, returns to her hometown outside Madrid with her Argentinian husband and children. However, the trip is upset by unexpected events that bring secrets into the open.","80,9648,53",False,/gJqQxpe03aIRZZjy8A4nbLtBpch.jpg,/1TuuM451os3NaltCwGfPCVL2BST.jpg
513349,The Factory,ru,2018-09-07,6.3,79,10.58,"When a factory is bound to close, a group of workers decides to take action against the owner.","53,18,80",False,/hKIGH0X7TxvS2UU0Ixrl7pxO3G9.jpg,/xWUPJmVA93U8QpzaUIqcR2iCeyG.jpg
516784,The Toybox,en,2018-09-14,4.2,99,10.564,"An estranged family take a trip to the desert in their used RV and become stranded and isolated in the scorching terrain. They soon learn their RV holds terrible, haunting secrets, and it starts killing them off one by one.","27,53",False,/5Ld1Mu7xSWtp2BElI8M5HqPf4Po.jpg,/f2m9g3Vhokis2fP6sufZo2esdC4.jpg
497722,The Coach,ru,2018-04-19,6.8,65,10.557,"Contemporary Russia. After he flubs a penalty kick, a humiliated national soccer player quits the game. He flees to a small town, where he decides to coach their local team.",18,False,/ijAFhrDIdv9BmhebtwJmCM4mUkl.jpg,/qYL9BXeV1WdjxvZvkesIqmhAYta.jpg
541660,Loro,it,2018-09-13,6.7,295,10.55,"Internationally released Director's Cut of ""Loro 1"" and ""Loro 2"", which were released separately as two movies in Italy. The film talks about the group of businessmen and politicians – the Loro (Them) from the title – who live and act near to media tycoon and politician Silvio Berlusconi in the years between 2006 and 2009.",18,False,/jLWXOlbmaCzsuOKfTKycW22ZjyC.jpg,/yAogxeovs5HpzhD4UbrDsSybtp7.jpg
520331,Let Me Introduce You To Sofia,it,2018-10-31,6.1,254,10.55,"Gabriele is a divorced dad who owns a music store and is completely focused on taking care of his 10-year-old daughter Soﬁa who spends time with both parents. One day he bumps into his old friend Mara who - for the ﬁrst time since his separation - reignites his desire to be in a relationship. There is only one problem, Mara hates children!",35,False,/edbJdTlYnqTvcydL3Ta1gZJlhZP.jpg,/oL60cVFtOc15iM4PWFmI8Kd5fpL.jpg
483455,Bungo Stray Dogs: Dead Apple,ja,2018-03-03,8.156,154,10.539,"A large scale catastrophe is occurring across the planet. Ability users are discovered after the appearance of a mysterious fog, apparently having committed suicide, so the Armed Detective Agency sets out to investigate these mysterious deaths. The case seems to involve an unknown ability user referred to as ""Collector,"" a man who could be the mastermind behind the incident. Trust and courage are put to the test in order to save the city of Yokohama and ability users across the world from the grip of Collector where the Armed Detective Agency forms an unlikely partnership with the dangerous Port Mafia.","16,28,35,9648,80,14",False,/vjnS4iu0SdwXm2LLqZGNCfpId9t.jpg,/vy8dW9kDuXWmdXcsBga3V4i1vtP.jpg
297725,The Man Who Killed Don Quixote,en,2018-05-19,6.77,999,10.495,"Toby, a cynical film director finds himself trapped in the outrageous delusions of an old Spanish shoe-maker who believes himself to be Don Quixote. In the course of their comic and increasingly surreal adventures, Toby is forced to confront the tragic repercussions of a film he made in his idealistic youth.","12,35",False,/7m0UQtFp3KQxUvKNr2DN9lDPdE.jpg,/4o4zw2c9sfHvszIb5xpuFagnouR.jpg
538604,The After Party,en,2018-08-24,6.105,204,10.486,"When an aspiring rapper goes viral for the wrong reasons, he thinks his career is sunk. But a wild party gives him one more chance to make it right.","35,10402",False,/6GyzqGMUMmSTcCdkOoEFEq2FUWD.jpg,/wFPGheX6X4bt1ZqP1870MPlUvGu.jpg
483184,Dogman,it,2018-05-17,7.537,2188,10.483,"Marcello, a small and gentle dog groomer, finds himself involved in a dangerous relationship of subjugation with Simone, a former violent boxer who terrorizes the entire neighborhood. In an effort to reaffirm his dignity, Marcello will submit to an unexpected act of vengeance.","80,18,53",False,/mgfxkCJLvudtnTOJml5mFbHWbk0.jpg,/eaZq1G8sJHv9f9a5IzioQlS3REX.jpg
434358,Belle and Sebastian 3: The Last Chapter,fr,2018-02-07,6.6,175,10.476,"12 year-old Sebastian has decided not to follow his father and Angelina to Canada, deciding to stay in the alps to watch over Belle who has now become the mother of three beautiful pups. When a stranger arrives claiming to be Belle’s rightful owner, Sebastian will do all it takes to protect his best friend and her little ones.","12,10751",False,/wFmh4k2ywZiMPCzq2ERDd2tmXAF.jpg,/5LGqOaSFa7cwyvtt7OWxvbWkRA2.jpg
471507,Destroyer,en,2018-12-25,5.9,705,10.462,"When Erin Bell was a young cop, she was given an undercover assignment that ended badly and destroyed her life. Years later, she must face her demons in order to make peace with her past.","53,80,18,28",False,/yuAIBhPc7mZWi6ZNDma5JVpWZhF.jpg,/sHw9gTdo43nJL82py0oaROkXXNr.jpg
424344,Gaspard at the Wedding,fr,2018-01-31,6.1,112,10.462,"After keeping a careful distance for many years, 25-year-old Gaspard must renew contact with his family when his father remarries. Accompanied by Laura, an eccentric young woman who agrees to pretend she's his girlfriend at the wedding, he finally feels ready to set foot in the zoo owned by his parents, where he is reunited with the monkeys and tigers he grew up with... But with a father who is an out-of-control womanizer, a brother who is far too sensible, and a sister who is far too beautiful, he unknowingly sets himself up to experience the last days of his childhood.","35,18",False,/sHJ3iWBUEnoO1e3xDQUZIilGYFf.jpg,/hR3RmVmxWomnJN7OFalIJGWfRKV.jpg
521873,Love in Bora Bora,fr,2018-03-04,5.6,70,10.461,"Valentine is convinced she’s in love with Jérôme, her best friend and work partner. She decides to share her feelings with him while they’re away in Bora Bora on a business trip. But there’s a bad surprise in store: Jérôme’s new girlfriend, Céleste, has decided to tag along. Valentine will have to put up a real fight to win over the love of her life, under the amused gaze of Marc, their guide in the “lovers’ paradise.” But as the days roll by, Valentine realizes she was wrong about Jérôme, and discovers true love elsewhere…","10749,35,10770",False,/7QttRVAefvGtoEPduetaYSl32x9.jpg,/mluRIYZSg1YapQx5xYcV4qcmLw8.jpg
666265,The Amaranth,en,2018-10-26,4.9,7,10.44,"Lily and Richard move to a luxurious and cult-like community, where Lily becomes unsettled by the transformation she observes in her older husband and in her own physiology, leading her to wonder if there's something more sinister at play.","18,9648,53,878",False,/9P0PvhVRJQ3PqIpKqapvCkRrlic.jpg,/jrAZxr1NKto1FEg4vcD0q2tQneU.jpg
501987,Bharat Ane Nenu,te,2018-04-20,6.525,59,10.438,"Bharat, a graduate raised in London clueless about the future becomes the Chief Minister of Andhra Pradesh due to the circumstances. New to India and with no political knowledge he learns the ropes quickly and governs efficiently. However, while he endears himself to the crowd, he makes enemies out of the political class, including his own party members who create trouble for him and try to stop him from bringing in changes in the society.","18,28",False,/6Vvk9YWecUrFboobXQgLCyowVnO.jpg,/a0hFV8G0ofyPgPEjVcYrueuxFex.jpg
540620,Laila Majnu,hi,2018-09-07,6.8,13,10.433,"Laila is a free-spirited girl from a conservative family who firmly believes in living for the present. Qais, a spoilt brat, falls head over heels in love with her. Their families, however, are warring over property, which leads to self-destruction, pain and bleeding hearts.","18,10749",False,/6wRBtkjf5DCmybSnnQ9PSEPT3s8.jpg,/3dOJVDLoLRqzDNgToXFwjCSwqL3.jpg
452731,The Land of Steady Habits,en,2018-09-12,5.5,164,10.422,"After leaving his wife and his job to find happiness, Anders begins a clumsy, heartbreaking quest to reassemble the pieces of his fractured life.","18,35",False,/bU1cdizoY6F5Z6kyXjJvg5lH0jy.jpg,/e2cdubbzgDBIVG8lELeQUq50qiZ.jpg
436494,Feral,en,2018-05-25,6.2,230,10.408,"A wild animal attacks six medical students on a weekend hike in the woods. One by one, they become infected with a “feral disease,” turning them into rabid, bloodthirsty creatures, and the vacation becomes a nightmare as they fight to survive each other.","53,28,18,27",False,/rgBJbPGoxRydcpjdijwo4AFIv43.jpg,/vZ72SsxEP9XSx3StaazsMwBi9C0.jpg
462148,Love Addict,fr,2018-04-18,5.9,343,10.401,Gabriel can't resist a beautiful woman. But his womanizing attitude is taking a toll on his career and social life. He decides to hire a life coach to help him.,"35,10749",False,/76KK7mJlgytYaqscUTTpXzHuxo8.jpg,/mPH90rwEdjxQhujwRxre6Xnt6Ng.jpg
429977,Hot Dog,de,2018-01-18,5.519,108,10.398,A pair of Tactical Units Police Officers from different walks of life come together to rescue an ambassador's daughter.,"35,28",False,/u5vtpnIyHvH6DHMZGAIuuVaGCtS.jpg,/nEkpOx3skQPOO9UZs26NGtiGMLP.jpg
512191,Howard,en,2018-04-22,6.9,48,10.396,"Though legendary lyricist Howard Ashman died far too young, his impact on Broadway, movies, and the culture at large were incalculable. Told entirely through rare archival footage and interviews with Ashman’s family, friends, associates, and longtime partner Bill Lauch, Howard is an intimate tribute to a once-in-a-generation talent and a rousing celebration of musical storytelling itself.","99,10402",False,/8B7ZCUeLsTqO72o0uVKMIQXSjOi.jpg,/kTMIYVGKeXsIcVumZvyapkhvQiY.jpg
470894,At First Light,en,2018-10-05,5.6,129,10.393,"High school senior Alex has an encounter with mysterious lights that appear over her small town. She soon develops dangerous, supernatural abilities, and turns to her childhood friend Sean. The authorities target them and a chase ensues as officials try to discover the truth behind Alex's transformation.","53,878",False,/lCqQefm3JsTDDlvOunM1YE9Cxu2.jpg,/wez4hCV7ltekZwRkQVyiKEZNrm5.jpg
456154,White Fang,fr,2018-03-28,7.3,197,10.391,A loyal wolfdog’s curiosity leads him on the adventure of a lifetime while serving a series of three distinctly different masters.,"16,10751",False,/yHddyijbb3jvRQcBQNZoZADMKev.jpg,/jJx8zvW0H2N1WxrjYE8hRxS1N3u.jpg
450489,Irreplaceable You,en,2018-02-16,6.958,690,10.373,"A stunning cancer diagnosis spurs Abbie to seek a future girlfriend for fiancé and childhood sweetheart Sam, who's clueless when it comes to dating.","35,18,10749",False,/A29oACLcWmIo8RDzNH7GNQziBbG.jpg,/hkflwtWCJffdDSwg63fdDFbwOvS.jpg
513377,Una festa esagerata,it,2018-03-22,5.664,119,10.349,"Mirea is about to be 18 years old, and her family is prepearing a big party for her. Teresa, Mirea's mother, wants to gain notoriety, so begins to spend recklessy for the celebration. When the day finally comes, an unexpected death puts it at risk.",35,False,/6ytT3YfAoF1R7RT1BAX6XoCEt47.jpg,/hvwRHzH0DBeIQlABzlJDFkUKrkN.jpg
519255,Bel Canto,en,2018-09-13,5.5,118,10.345,A famous opera singer is held hostage in South America by a guerrilla rebel group after performing at a Japanese businessman's lavish birthday party. Unexpected bonds are forged in the standoff that ensues.,"18,10402,10749,53",False,/4YkPzGBn3M8L6JirvQJy3UK6597.jpg,/2pRvnOhFdANmdzDXfuLlZV9jwSb.jpg
489988,Three Identical Strangers,en,2018-06-29,7.3,698,10.315,"New York, 1980. Three complete strangers accidentally discover that they're identical triplets, separated at birth. The 19-year-olds' joyous reunion catapults them to international fame, but also unlocks an extraordinary and disturbing secret that goes beyond their own lives – and could transform our understanding of human nature forever.",99,False,/2shn4Kiq7qInZgKZhqM5BKie1zL.jpg,/esPoJNMBsgWXahv8gILIl5K6sFk.jpg
512418,Mr. Know-It-All,fr,2018-05-09,6.8,201,10.311,A football coach afraid of commitment has to take care of his nephew with Asperger's Syndrome.,"35,18",False,/feLART0T7olhBYkYL9Ir4SJSzMy.jpg,/dyRrOuQa2JpfKvyu1F1NjaF0CaT.jpg
491629,Raazi,hi,2018-05-10,7.159,161,10.291,An Indian spy is married to a Pakistani military officer during the Indo-Pakistani War of 1971.,"53,28,18,36",False,/gsKNlRSAjR7oZQyvGBfU110VeC2.jpg,/fF2xXApETxZqyluokyJ1x4gIiTf.jpg
390874,Ashes in the Snow,en,2018-10-12,6.612,112,10.283,"The coming-of-age tale of 16-year-old Lina Vilkas who is deported to Siberia amid Stalin's reign of terror in the Baltic region during WWII. An aspiring artist, she secretly documents her harrowing journey with her drawings.","18,10749",False,/xC0XeQOlbA8T7TVs4PiGvH5krDh.jpg,/wRMgle7vPFvSMq5R76JhsH54W4S.jpg
516027,Hippopotamus,en,2018-01-02,5.8,69,10.259,"Ruby wakes from a bad dream to find herself in a real life nightmare. She's trapped in a basement, her legs are broken and she can't remember who she is or how she got there. Her kidnapper, Tom, tells her she will remain captive until she falls in love with him. Ruby is focused on trying to escape until Tom starts helping her to remember her past and she begins to question everything.","27,18,53",False,/nqZoPFsVGFLx2Itl4jv9qOeg8M3.jpg,/yFXyiBp3SVxu3U9SYpbZxvjgFfX.jpg
