id,title,original_language,release_date,vote_average,vote_count,popularity,overview,genre_ids,adult,backdrop_path,poster_path
484664,Marlene,de,2020-01-22,6.5,32,3.549,"Frank is a contract killer working for a large Styrian crime syndicate. When he is given the task of abducting a girl named Marlene and delivering her to the syndicate, everything changes for Frank. He falls in love with Marlene and disobeys his superiors, who in turn take matters into their own hands and abduct Marlene themselves. Now Frank has to battle the blunt forces of the syndicate in order to save Marlene.",28,False,/7OQstMMmPIAVC2PWAiXuXLjQADA.jpg,/vVXSmL8XS7hOcejq2lR3SFyLx99.jpg
588081,Quanta,en,2020-11-18,4.0,3,3.548,A physicist's life-long work comes to fruition when he is reluctantly partnered with a gifted young assistant. Ego divides them when they receive an unknown signal from space.,"878,18",False,/umKHPxLq0Om30WCGoERt2zg4agf.jpg,/wISCu6I87n3ZnF0En0EEO7fMWVZ.jpg
680495,A Killer in My Home,en,2020-02-28,5.8,8,3.546,"Allison Winters' world falls apart when her husband dies of a sudden heart attack, announcing on his death bed that he has a secret family. Six months later such family arrive on Allison's doorstep, determined to be a part of her life.","53,80,10770",False,/hlzwGIThQWD9x1CY0jxPtMut1MM.jpg,/2laVEwzkImIRh0eE2LihCxZIf5q.jpg
639250,The Voices,en,2020-07-03,5.2,23,3.546,"Angry and upset after a sudden breakup with her fiancé, Grace Crawford seeks sanctuary at the remote home of her sister, Catherine. It becomes clear that Catherine is suffering from paranoid schizophrenia, much like their late mother, who had taken her own life. While coming to terms with this heavy realization, Grace also uncovers another terrible little secret that has her struggling to maintain her own sanity and ultimately scurrying to save herself and her family from further harm.","27,53",False,/iaPdWPtmQXn8JxyPhum72D1yT43.jpg,/vFV4GnGheaTRpe5FHHbxyWsOpsp.jpg
778776,"Basic Instinct: Sex, Death & Stone",fr,2020-12-15,4.3,5,3.544,A documentary about the Paul Verhoeven's cult classic Basic Instinct.,99,False,,/ybt8xEFUGGv0ZnOIOJdiAsX4mMt.jpg
657018,A Beautiful Place to Die: A Martha's Vineyard Mystery,en,2020-01-12,7.2,37,3.544,"After being forced into early retirement, former detective Jeff Jackson returns to a quiet life on Martha's Vineyard. Quiet, at least, until a body washes up and he's drawn back into crime solving.","9648,18,10770",False,/rLvCBm8SBx51mtzfepgbw7FPX1K.jpg,/3FGGJh5S9G29YGIRYqe3zca40yL.jpg
754744,Ball Red Daughter-in-law,ko,2020-10-16,5.4,5,3.542,"Hail is worried because Seungha, a pretty and sexy daughter-in-law, looks like a woman these days. An open-minded way of walking around the house in short clothes without hesitation, showing aegyo, etc. It is becoming increasingly intolerable to the tsunami. Hearing the sound of his son Do-jin and Seung-ha having sex is also starting to get harder. One day, the tsunami was spent relaxing at an illegal massage parlor. He takes a nap, but Seung-ha appears and seduces himself to dream of having sex. Seungha gazes at the tsunami who wakes up after having a sweet dream.",18,False,/4EGvllNPwr8WF2Tzu7EXjkzakrb.jpg,/uQD0RqVvBsrPh82G7kOBWdM9yWo.jpg
796562,Love Unlock,tl,2020-07-15,0.0,0,3.54,Four people whose lives are intertwined in love will set their true feelings free in the original digital special ‘Love Unlock’.,18,False,,/HsZNJ8Wa0nZNSs29HepiC1NYM4.jpg
702701,Love at Look Lodge,en,2020-09-26,6.8,36,3.54,"Lily dreams of being a hotel event coordinator and is thrilled when she's given the chance to do so by helping Noah, a hotel guest, finish planning his sister Justine's wedding at a remote lodge.","10749,10770",False,/vk7YuKyALJJ5lpBZDR92FxPpdrd.jpg,/yW6c7lyJIhfiklmsqBfpugHHywS.jpg
663105,His,ja,2020-01-24,6.7,20,3.539,"Shun and Nagisa first meet and fall in love during their first year of high school. While Shun is graduating from university, Nagisa tells him that he doesn't see a future for them. Despite Shun's strong feelings, they go their separate ways. Years later, Shun is now a store owner, living alone in a rural area. Out of the blue, Nagisa arrives with his six-year-old daughter, Sora. Spending time together, Shun realizes he still harbors feelings for Nagisa. Can Nagisa reconcile with his feelings for Shun, which have been there all along?","18,10749",False,/unGBAgFxeKUzGEsTReV2ECphMVl.jpg,/ePBDOSLQ26voWspjWoDn1GuhiU8.jpg
738170,Dark Tales,en,2020-08-25,6.5,3,3.538,A gruesome group of scary stories designed to erode your sanity and perception of evil. Brought to you by a creepy cabal of underground horror directors and talent from around the globe. Who dares venture deep into the diabolical and demonic world of Dark Tales?,27,False,,/7FIbpKuJaFbrvBA7tECrwFb7Yxt.jpg
728128,"Paolo Conte, Come Away with Me",it,2020-09-28,7.2,13,3.538,Documentary follows the life and work of Italian singer and composer Paolo Conte.,99,False,/qjNlrW2WCjXL1pFhCm1JEJUpRyh.jpg,/pyjuuKaqnz2L2Y7hZGo6JKqFXUS.jpg
653581,High Tide,es,2020-05-07,4.9,11,3.533,"Laura is spending a few days at her beach house to supervise the construction of a barbecue shed. One afternoon, she seduces the chief builder, who never returns. Over the following days, the builders continually invade her home – until Laura grows ferocious.",18,False,/weGP8HmjYP96Lzk1ipUeh1aIZPK.jpg,/8vZWDEudoKakmVlCxfga5Pj7mgz.jpg
632251,Prey,es,2020-02-28,6.2,32,3.53,A girl paralyzed. A rabid dog. A duel to death for survival.,"53,27",False,/1Nn68IflKMQ0qjOBgltnJ4eKVdS.jpg,/g0v7GKv6oGIfDox0FoB1a52ZRLJ.jpg
603258,Conference,ru,2020-10-22,6.8,9,3.527,"Many years after a deadly terrorist siege in a Moscow theatre, survivor Natalya returns to the crime scene to hold a memorial evening, finally able to confront her survivor's guilt and her estranged daughter and husband.",18,False,/q5gZqrrOyBSMwjekoe4xL1i0GCS.jpg,/g88nR0d1BURPyI5gbpnKfNC4lR1.jpg
597093,Ghost Tropic,nl,2020-01-01,7.5,11,3.527,"After a long day at work, fiftyeight-year-old Khadija falls asleep on the last subway train. When she wakes up at the end of the line, she has no choice but to make her way home on foot. On her nocturnal journey she finds herself compelled to ask for and give help to the other inhabitants of the night.",18,False,/Dpa1ah0YYFoGgKOw2ogeHH2msd.jpg,/gZFuhwJWHPzsPGMtfJGppgBopxO.jpg
852316,Young Mom 4,ko,2020-10-23,0.0,0,3.524,"Ji-seok, who raised her daughter Yoon-jeong by herself has had troubles that she cannot talk about. He's just looking to tell his daughter that he has a woman to marry. Since the bride-to-be Soo-jin is of the same age as her daughter, Yoon-jeong is afraid of opposition and cannot speak. Ji-seok finally asks for help from his daughter's boyfriend, Seok-joo, who came to play at home...","18,10749",False,/xreHRmcieqWhLxQG45HH0UziAp9.jpg,/18q0f3Se8tM3qbTpqUG9UiCn9Yz.jpg
685615,Doll House,en,2020-03-23,4.722,18,3.522,"Doll House is the story of an 11-year-old runaway who arrives at a care home with her only possession a dolls house. She refuses to speak and won’t ever let go of her doll. The other children tease her. People start to disappear and seem to appear as tiny dolls inside the doll house. An evil entity haunts the doll and doll house and is collecting the souls of the children for its ultimate cause, to be alive.","27,18,53",False,/g3BWeWVQTjiWjDfcGuNsJAwIUGq.jpg,/pQ2YxzSfK3jNuL77K5MoJeQk4ls.jpg
657893,Mr. Miao,zh,2020-07-31,4.7,9,3.521,"The feature introduces a fictional golden-colored flower, which possesses the magical ability to debauch humans who get too close to it. As the flower only chooses kindhearted people as hosts, a group of martial artists who want to eradicate the plants face a dilemma: should one kill good people for rescuing men from sin?","16,28,36,14,18",False,/spUJry0AnwL62rICAIUli0tnaqA.jpg,/sZ91Memjnc5XivmpaQiz3W1oeAD.jpg
734423,A Night at the Louvre: Leonardo da Vinci,fr,2020-09-16,6.7,3,3.518,"A guided tour through the corridors of the Louvre to closely contemplate the works of Leonardo in the company of the curators of the exhibition, Vincent Delieuvin and Louis Frank.",99,False,/nGawQ1xyPBLzVByreYemrFYnT0w.jpg,/rJRT5odN7kInwykZUGrepxvntK2.jpg
554375,C'est la vie,fr,2020-12-30,5.5,55,3.518,"Five women are about to give birth. They do not know each other, are not alike, but will find themselves in the same maternity to live the best day of their lives. The first contractions at birth, the film traces their journey, between laughter and tears.",35,False,/bm11ZmZSKNG67gcwmJGEVTYDmPG.jpg,/ie96hFRmdWEqiSSegaT3K48yMzD.jpg
737195,The Man in the Hat,fr,2020-09-18,5.885,13,3.515,"The Man In The Hat sets off from Marseilles in a small Fiat 500. On the seat beside him is a framed photograph of an unknown woman. Behind him is a 2CV into which is squeezed Five Bald Men. Why are they chasing him? And how can he shake them off? As he travels North through France, he encounters razeteurs, women with stories to tell, bullfights, plenty of delicious food, a damp man, mechanics, nuns, a convention of Chrystallographers and much more, coming face to face with the vivid eccentricities of an old country.",35,False,/kTkAdzFxj4wSJW6j43sV9QHpkuB.jpg,/hYLhSAbVW1Wa9mRX05DGCL5X20w.jpg
891657,LEGO Hidden Side: Night of the Harbinger,en,2020-10-31,6.1,19,3.511,Jack and Parker work to seal a Hidden Side hole when a fire ghost escapes covered in a strange silvery substance and reveals that their world may be doomed.,16,False,/AgL1aKZcvzG0XCXosFQaBgibaac.jpg,/yoDchepiE9Tcv36ivkzOF4z75ws.jpg
780525,Corona Depression,en,2020-12-28,5.8,59,3.511,"A pandemic strikes the world. What does quarantine do to a lonely woman's mind? Follow her from sense to insanity. No filters. Just you, her, and her more and more twisted mind.",18,False,/44hiRPhvo4i8o3UCwZSzP6GxvS3.jpg,/21lpJsgxypW77rxbKjjUMWKTmjZ.jpg
645292,The Way We Are,tr,2020-01-10,5.6,24,3.511,A group of old friends get together to be with their beloved aunt/grandmother who took care of them when they were kids for her last days. And things get complicated.,"35,18",False,/bPuRLnwc6n2uvJOHWf2YaSODqKT.jpg,/m270dUDEoLA4YDqVOVERE9RfDUp.jpg
752885,Octonauts and the Great Barrier Reef,en,2020-11-12,5.4,5,3.51,"In this musical special, the Octonauts must find a way to hold back hungry swarms of coral-eating starfish to save a new friend's fragile reef home.","10751,10402,16",False,/qZS1HLXhr0sQrBY7HSYeaHREqKD.jpg,/bk4RqSZ8FtCwMzXwiuxxoFZUHmU.jpg
719578,The Gun 2020,ja,2020-07-10,5.3,3,3.51,"Toko grew up unloved by her mother Mizuho who continues to adore her deceased son. She lives alone in an apartment the electricity has been cut off and the trash is piling up. One late night, Toko enters a gloomy building in order to escape from a threatening stalker, Tomita. There she finds a handgun. She brings it back home and confirms it is loaded with four bullets.  One day, the family living next door who have already been enduring poverty and violence end up murdering a man. Toko helps them bury the man's body, shooting it with the handgun. Toko becomes captivated by the gun itself. She is further entangled in the true circumstances of the incident due to the detective searching for the handgun and a suspicious man Kazunari who knows a secret about the handgun. Toko tries to throw herself into the whirlpool but then the lid is blown off her ""past.""","53,80,18",False,/24YJrPXB7SXxad2V8VFOXS1d4yt.jpg,/83WxGXZkgbebEG1CSviIjz9tj1D.jpg
618245,Atlantis,uk,2020-09-17,6.5,43,3.506,A soldier suffering from PTSD befriends a young volunteer hoping to restore peaceful energy to a war-torn society.,"10752,18",False,/zXVSr2AovV17IAJjBy25Juc2DmX.jpg,/zR9P1t3jiXbxiwl0Ygqgw1Fh5cy.jpg
771582,Yongju Valley 2,ko,2020-12-03,0.0,0,3.5,"""Yongju Valley Legend"" Mina, who was known for her sexy looks and best sex techniques in the past, made a comeback with ""Yongju Valley Clinic"" again after five years.  As the rumors that the sex treatments here are effective, erectile dysfunction, premature ejaculation, perverts, etc., men with problems come from all over the country.  Finally, ""Yongju Valley Legend"" Mina's 3 sex treatments are revealed...","10749,18",False,/sGqjPfbvufhs2oAqw0uNVXSsJro.jpg,/2KKOD5d73ixoRqbYltM0SjFSY3G.jpg
731169,Oversize Love,zh,2020-10-30,4.7,3,3.5,"A fat girl with cheerful and generous personality gets caught between her feeling for her childhood sweetheart and a famous idol, after an unexpected appearance change.","10749,35",False,/iQz2BAh9QsVIo5e43aRYU6pbtlP.jpg,/zIHL8Kas71MJCwh2ykW63QVRY70.jpg
664602,The Shepherdess and the Seven Songs,hi,2020-02-28,4.3,3,3.5,"Trapped between her cowardly husband and regular harassment by a local authority, Laila, a nomadic shepherdess, decides to break out of her old identity and chart a new path.",18,False,/yj2UO1S9zjNAAcdLh5UBgEIw9Iw.jpg,/gY2YOqQG1fWtoL83sDzS02nuw4X.jpg
725691,Midnight Swan,ja,2020-09-25,7.4,13,3.497,"Nagisa is transgender. She grew up in Hiroshima as a man, but now lives in Shinjuku, Tokyo as a woman. Due to an incident, she begins to live with middle school student Ichika, who is a distant relative. Ichika has been neglected by her mother Saori. From living in solitude by herself, to now living with Ichika, Nagisa develops maternal instincts for the first time.",18,False,/lmgFNGkrL7h9OIb2IOV7RSmoTo7.jpg,/7zdJSbj5pZbeQgiMyVnGq9lysiI.jpg
1105619,Ultra Galaxy Fight: New Generation Heroes,ja,2020-02-27,6.0,2,3.493,"Somewhere on a distant planet, X and Geed were defeated by a pair of black Ultramen who bore their likenesses in appearance. At the same time, an old enemy of Taro named Ultra Dark-Killer targeted both Zero and Grigio, forcing Taro to recruit the New Generation Heroes to stop the League of Darkness.","14,12,28",False,/gBxAI0RFqXSTZi0RtJDReijMubo.jpg,/jZ7JUhCQ7c9EetbePDhTfKundkJ.jpg
814366,86.10° North,he,2020-09-07,0.0,0,3.493,"86.10° North follows Alex in his first months on a deserted research station in the northern part of Greenland, with his only connection to the outside world being Emily who talks to him from another station.",18,False,,/d32HBkDFS8tR3BE3ghNFdjZFGgO.jpg
728945,"The Good, the Bad & the Corny 2: Secret Army",fa,2020-07-29,2.0,2,3.493,"A counter-revolutionary group led by Dr. Madani and under the supervision of Donald Trump will send a mission to Farbod in Iran as a film crew. There, Pejman Jamshidi and Sam Derakhshani are selected as actors in the film Secret Army. Farbod tries to carry out the operation, but Pejman and Sam destroy almost everything and…",35,False,/lI6OCqGZDECkdu4WDbywDK8KPDY.jpg,/b9TonG6HQCpGWFQGOJVxbgsj13L.jpg
612361,Wild Sparrow,zh,2020-07-24,9.0,1,3.492,"Little Han lives in the mountains with his great-grandmother, Auntie Han-hsiao. In rainy days, Little Han sits in front of the fireplace listening to Auntie Han-hsiao’s colorful and mysterious tales. One day he sees an injured and dying sparrow. With sadness, he digs a small cave and buries it.",18,False,/w1XqKhjue9YN8jrhcWuJbLiqHYU.jpg,/aoj0zxRkVpkNoxsHR9HdbTyzate.jpg
734603,Child of the Stars,ja,2020-10-09,7.7,6,3.49,"When Chihiro was a baby, she suffered from eczema. Her parents tried to find a cure, but nothing worked. Her father's co-worker then gave him some water from a strange religious group. Chihiro was miraculously cured by the water. Her parents began to follow the strange religion and became fervent followers. Chihiro is now in the 3rd grade of middle school and she faces changes in her life.",18,False,/xNQwi8xqprPV30hK6C5htvASn8v.jpg,/pCEgbsx4quddy9VX5hf4raXmAi8.jpg
674349,Vendors' Meeting,tr,2020-02-20,5.1,41,3.486,"How much chaos can three white goods dealers who come to İstanbul from Anatolia get into in three days? The paths of Namık, Adem and Sadık, three men going through difficult periods in their lives, intersect at a dealer meeting. After a series of unexpected events, they find themselves caught in a crazy plan. To survive, the three dealers have no choice but trust each other and move fast.",35,False,/omo0IBMbkAFtq1XQmw6W9eO1cLm.jpg,/1NDdIO4LhCtYgYgF0iEiAwx2vOE.jpg
777644,"Fais pas ci, fais pas ça : Y aura-t-il Noël à Noël ?",fr,2020-12-18,5.9,16,3.483,,35,False,/2liJIAg90qkmxzIQn4eeb2w4sno.jpg,/4fHXwPV909Hc1Kx6pawLDYbMIUD.jpg
721587,Corte,pt,2020-08-25,5.0,2,3.475,"At the core of a royal court unbalanced by the long absence of its King, where women seem to have disappeared along with reason, the Crown Prince is murdered. Wrapped in the plot of the promoters of a decaying libertine spirit, the heir’s brothers, a pair of twins united by the music they play together and their Valet, witness a hunt for the prepetator launched by the palace doctor's deduction. In the background of all the chatter rises the individual desire of the twins for the dynasty.","18,36",False,,/84FZ7YjS7ClmyY2C6IELsHzRZYa.jpg
681509,My Heart Goes Boom!,es,2020-10-02,6.2,69,3.475,"Spain, 1970s. While a cruel dictatorship rules an eternally grey country through fear, violence, repression and censorship, María, a young dancer, dreams of bringing bright colours into her life and the lives of others, as she makes her way towards personal freedom and pursues her crazy dream of becoming a TV star; a very funny journey in which she will be comforted by the pop songs of the incomparable Italian singer and dancer Raffaella Carrà.",35,False,/acGKpM38ks3FVzs3RHqTweMHB9p.jpg,/wSfwZlSSffa8Cak70S6xWzebnnI.jpg
632929,Jazzy Misfits,ko,2020-05-27,6.5,8,3.475,"An aspiring singer Sun-deok is visited by her mother, whom she hasn’t spoken to in years. The abrupt encounter leads to the news of her younger sister Yuri, who had vanished with their savings. The mother-daughter team is now hunting for the missing girl and their money, poking around in Itaewon, the international hub of Seoul. Little do they know that soon they will be faced with Yuri’s unlikely secrets.","35,10751,18",False,/ivRlYj3Bm4RZDSDCKRAAyS1C2um.jpg,/vWsU2ThjBbYe7yIX1rIsMMdPWSQ.jpg
886559,Shuttlecock: Sins of a Father,en,2020-12-31,6.0,3,3.47,"At the memorial for his father, WWII hero Major James Prentis (Alan Bates), John (Lambert Wilson) confesses a dark family secret to his own son Martin (David Oakes), something that he has harbored for over twenty years. A suspense drama, it explores the complex nature of heroism, betrayal, and father-son relationships. This is a reworking of the director's original 1993 film entitled simply, Shuttlecock.","28,10752,18",False,/31LmKCQ3Tg4EQIDvvMP7dBfPYL1.jpg,/eRCil9cS9aOGe1Grh4KfQpeBCvV.jpg
682258,His Fatal Fixation,en,2020-03-01,6.1,9,3.469,"After surviving a violent attack at the hands of a jealous stalker, flawless beauty Lily Abrams moves to a new city looking for a fresh start. Physically scarred and struggling to cope with dark trauma from her past, Lily is haunted by visions of her stalker at every turn, and is at risk of unraveling, losing her new job, and the new life she has built for herself. Sarah Fisher, Robin Dunne star","53,10770",False,/l3a7y6STPSPWT7azHD0FfSBBkZd.jpg,/dJ0xcqipVRTgmBB1QHui5QkmOOf.jpg
583293,Complete Strangers,en,2020-12-01,4.8,9,3.468,"A recovering alcoholic returns to his hometown after a hiatus, and falls in love with a man who will turn his world upside down.","53,9648,18,10749",False,/jXDlL1Cyo5HmEV3byHMeC2SWUle.jpg,/s7SaAiUhyThkw6v3IDRG6vwOJhl.jpg
647813,Divorzio a Las Vegas,it,2020-10-08,5.7,67,3.467,"Lorenzo known as Ghandi and Elena met at 18 during a vacation through Nevada and ended up doing the classic madness: they got married in Las Vegas. A few hours later everyone was going their own way, putting the incident behind them (or at least that's what Elena thinks). Twenty years later Elena is about to marry a very rich and brilliant man, but her best friend Sara, a lawyer, informs her that, being technically still married to Lorenzo, she must first dissolve that bond or she will be accused of bigamy. Elena and Lorenzo must therefore return to Las Vegas and obtain a divorce decree in a few days. If they really want to.",35,False,/kLMw1HRET9jHlAjq5DiKeiErAtm.jpg,/qo7ECVZ6KybwFiM6VlbEaqYcuy7.jpg
781346,Found Footage of Fear,en,2020-12-31,2.0,1,3.466,A young woman searching for her missing friend is lured into the basement of a serial killer where we are witness to his collection of gruesome video tapes.,27,False,,/4P9vho4y7if7GEcyDuFbfQ2OEIn.jpg
663892,Baby Monitor Murders,en,2020-01-10,5.4,10,3.462,"Cassie Temple accepts a job as a babysitter back home after her internship falls through, however she begins suspecting her employer is up to something sinister after overhearing a murder plot.","9648,18,80,10770",False,/u7QC09733T2cYVP2HoRLsyLkrvy.jpg,/wLtAaDXbixUTIGmADo1A4uky0LG.jpg
664498,She's In Portland,en,2020-01-16,5.8,8,3.461,"Two college friends, now in their thirties, admire each others' lives and feel trapped in their own. Wes, tied to a demanding career and responsibilities to family, extends a work trip to drag his dispirited artist friend Luke to find Luke's ""one that got away.""",18,False,/kPgjvYbcoFWieLxR8ikULXMmOqE.jpg,/eYFNEfVBE86Z08T9vpo5hC0dAD3.jpg
658006,Romance Doll,ja,2020-01-24,5.38,25,3.461,"It was a pre-destined love and marriage for Sonoko and Tetsuo. They tied the knot and became husband and wife no questions asked. All is well then. Well, perhaps not. Each holds a secret that even the binds of matrimony cannot untie. Sonoko does not know that Tetsuo makes sex dolls or Dutch wives. Sonoko has a secret too. She is about to tell Tetsuo what she has been hiding. Their marriage is already sexless. Will they make it?","10749,18",False,/5GGaoOxrSeFAGXoLOISyD4cjZAQ.jpg,/68tDy1xSJcT3kFpKimenuVVHqzJ.jpg
701062,"Sí, Mi Amor",es,2020-01-23,6.9,41,3.46,A blindsided boyfriend must prove his fidelity when his girlfriend spontaneously dumps him after suspecting him of cheating. Based on the successful stan-up comedy show of the same name.,"35,10751,10749",False,/vry06FdGbTa6WNnVQit3KFqBq4T.jpg,/gKo5wY3YbfvfHkUUTl9eovMc3bq.jpg
745236,Miniforce: Raid of Hamburger Monsters,ko,2020-09-30,10.0,1,3.459,,16,False,/6zFOEGwhY3jTPefhJCzw5z6ur4B.jpg,/5iajovFBxADXfmUu4Kh2xk5Udq4.jpg
779632,Clown,en,2020-12-25,6.2,4,3.458,"Follow a little toy clown, thrown away with a load of old discarded toys, as he goes on a journey to find a new loving home for himself and his friends.","16,10751,14,12",False,/koQi9BuqdnBIwgBRjLuRcPsC1QT.jpg,/utPCwCOscbbVSQTovFvhAc7o0eb.jpg
759216,Andhaghaaram,ta,2020-11-24,7.2,24,3.457,"As a blind librarian, dispirited cricketer and desolate psychiatrist each seek retribution and release, their lives overlap under eerie influences.",53,False,/opX6KQVEsOotpJGDZal1wydhNTY.jpg,/8sBXVEROEXoRaNEU8TYx26JZyeG.jpg
754560,Disney Channel Halloween House Party,en,2020-10-16,8.5,2,3.456,"Disney Channel fan-favorite stars take on a variety of zany characters and spooktacular spoofs in this sketch comedy show. Filmed remotely, and hosted by Tobie Windham (""Just Roll with it""), the cast transforms themselves and their homes for a hilarious party filled with wacky sketches, including a befuddled monster, a pet goldfish’s virtual celebration, and other ghostly surprises and treats for kids and families.","35,10751",False,/uZcObQyrpo8w1ZXzMv62EwMB5kT.jpg,/t8G4pqm6ybaOYQN5NbsNMtX5us8.jpg
662989,Savage Creatures,en,2020-01-07,5.5,36,3.456,Two bloodthirsty vampires begin to realize that their food source is in jeopardy now that alien creatures have landed on Earth.,27,False,/k5x3qXlEM1zvkgrqH3CNd61V7Vx.jpg,/sSYUGaOxfidNctDpep4HWNIoW6Z.jpg
722918,Tiny Tim: King for a Day,en,2020-08-20,6.1,11,3.455,"The story of Tiny Tim’s improbable rise to stardom is the ultimate fairytale - and so is that of his downfall. For a brief time, the shy and truly unusual outsider artist was the biggest star in the world.","16,99,10402",False,/rQ1EBYpDFGInlLFpkuk26bEQ8QV.jpg,/mmoe55IQNNis8ad0zoxGzDl67Jc.jpg
623266,The Artist's Wife,en,2020-09-25,5.6,10,3.455,"Claire Smythson, wife of the renowned abstract artist Richard Smythson, is plunged into a late-life crisis when her husband is diagnosed with Alzheimer's disease and is in danger of not completing the paintings for his final show.",18,False,/khQ28AP9BBzFWqB6cbeuuvXIT1d.jpg,/g0GLJ7hRTMwBAbFq5Zkm90kUByz.jpg
728209,The Perfect Weapon,en,2020-10-16,6.8,20,3.452,"Explore the rise of cyber conflict as the primary way nations now compete with and sabotage one another.  As fear mounts about how potential cyberattacks will affect 2020 elections in the U.S., the film features interviews with top military, intelligence and political officials and includes on-the-ground reporting from the frontlines of the cyber wars.","99,80",False,/4xqJfciK7O0GRs69yqv0nFrZDht.jpg,/bXphpQgetq4FZJN1cNnX1FpGcS5.jpg
686684,Pooka Lives!,en,2020-04-03,6.0,34,3.452,"A group of thirty-something friends from high school create their own Creepypasta about Pooka for laughs, but are shocked when it becomes so viral on the internet that it actually manifests more murdererous versions of the creature.","27,53,10770",False,/oFbDDdfrxILgzlTaVHAQQYySsWC.jpg,/c8orAPNmomaXTVjikjMSYaanWh.jpg
721176,사내정사: 은밀한 회의실,ko,2020-04-24,5.0,1,3.451,,,False,,/zz66uNaiRcomt5KclqtfjvR95pY.jpg
705728,First Vote,en,2020-05-05,0.0,0,3.451,"A soon-to-be first-time voter, the filmmaker’s thought-provoking journey into the Rust Belt and South captures four Asian American voters’ ardent first time grassroots political participation ignited by the 2016 rise of “Chinese Americans for Trump.” FIRST VOTE is a character driven cinema verité style film chronicling the democratic participation of four Asian American voters from 2016 through the 2018 midterm elections.",99,False,,/aeBODgxqXVj8PYjwWagII0dL7Gy.jpg
1020428,"Inside Asda: Bigger, Better, Cheaper?",en,2020-01-06,6.467,76,3.45,The supermarket giant that rose high by taking prices low.,99,False,,/k8B1JxJHyhLcKe5uGCKdE96DPps.jpg
