id,title,original_language,release_date,vote_average,vote_count,popularity,overview,genre_ids,adult,backdrop_path,poster_path
422615,The Clapper,en,2018-01-26,4.9,268,13.231,Eddie Krumble works as a paid audience member for infomercials and experiences a whirlwind of overnight fame after a late-night talk show host publicizes his frequent infomercial appearances.,35,False,/xKtwGBji7GJSevvapkT0xZwBR0Y.jpg,/vsm2gxPoZDzG3ocTArrK8ak7go4.jpg
441393,Ash Is Purest White,zh,2018-09-21,6.843,316,13.213,"Set in China's underworld, this tale of love and betrayal follows a dancer who fired a gun to protect her mobster boyfriend during a fight. On release from prison 5 years later, she sets out to find him.","80,10749,18",False,/hyrlqRHhxxSEKjj10e0Xtbcmzwc.jpg,/l6UkF23uWkO25x7UEMnT0H4R5GR.jpg
527642,Flight 666,en,2018-05-29,5.5,60,13.208,Passengers and crew on a flight are attacked by unseen forces that threaten all aboard.,"27,878",False,/5sxqpW1N9ZYAuo4uMKZaKFA5cRo.jpg,/3K52LBS5VW0tcgrZAMMJXvTOAkM.jpg
517062,The Most Beautiful Girl in the World,de,2018-09-06,7.5,111,13.182,"17-year-old Cyril is funny, smart and an all-round good guy. Just his somewhat overlarge nose spoils the picture. On a school trip to Berlin with Roxy, a stunning new classmate, Cyril is not the only one taken with her. Benno, the class Casanova has his eye on the girl too and makes a nasty wager. Roxy is more interested in the introverted Rick, who is not only shy but also slow. Cyril hastens with his spoken word skills to Rick's aid, and falls head over heels in love with Roxy himself. So whose brave heart will win the fair lady?","35,10749,18,10402",False,/5MGX3rJdg7vO0o7CnRw3wfpfIjv.jpg,/1rKmeMAy792AqhqFxhKdnJmD6lM.jpg
375785,Then Came You,en,2018-12-05,7.4,474,13.168,An American hypochondriac who is working as a baggage handler is forced to confront his fears when a British teenager with a terminal illness enlists him to help her carry out her eccentric bucket list.,"35,18",False,/9oI4ImMclu3l0OHaK7o9eELfL3l.jpg,/658QP5tmBRUlE5JvxOnnmITfG1F.jpg
545963,Norm of the North: Keys to the Kingdom,en,2018-08-31,5.1,36,13.166,"When Norm returns to New York, he is falsely accused of a crime and must work with his pals to get the case dismissed while also protecting his kingdom in a winner-take-all hockey tournament.","16,35,10751",False,/nvp54siZbqpckAAkVShnhLyZhgS.jpg,/fJNOVMY6UqO8yoZge0odKpeNU8m.jpg
455108,The Little Stranger,en,2018-08-30,5.695,256,13.162,"In a dusty post-war summer in rural Warwickshire, a doctor is called to a patient at lonely Hundreds Hall. Home to the Ayres family for over two centuries, the Georgian house is now in decline. But are the Ayreses haunted by something more sinister than a dying way of life?","9648,27",False,/eyrUZ6jvg1Qy3jUz5YH8U4UkFLP.jpg,/izPtQ2relqT5LWflL7x4JLTbLxy.jpg
341735,The Seagull,en,2018-05-11,5.5,101,13.156,"At a picturesque lakeside estate, a love triangle unfolds between the legendary diva Irina, her lover Boris, and the ingénue Nina.","18,10749,35",False,/Aw4zLO93zRgB2DSGBseRtIkuBeh.jpg,/6nVjSIUScmDScEEfnc7i0eSBthc.jpg
495193,Benji,en,2018-03-16,6.9,297,13.143,"Two school kids strike up a friendship with an orphaned puppy named Benji. When danger befalls them and they end up kidnapped by robbers who are in over their heads, Benji and his scruffy sidekick come to the rescue.","18,35,10751,80",False,/eOkbeZ658RHVt7ULoFBqmesxEYX.jpg,/79pacM3h5FoETnfuRC6O2qPfzn4.jpg
543753,High Society,ko,2018-08-29,5.6,49,13.119,"The story of the journey of married couple up the social latter. The husband is professor at Seoul National University who is running for the National Assembly, and his wife is a painter.",18,False,/itqi4DhDlyWTdd1aISTSK2qrb1R.jpg,/jiNYN0LDfBllYAYOkT4NJPaOvuH.jpg
438145,Black '47,en,2018-09-05,6.544,294,13.068,"In 1847, when Ireland is in the grip of the Great Famine that has ravaged the country for two long years, Feeney, a hardened Irish Ranger who has been fighting for the British Army abroad, returns home to reunite with his estranged family, only to discover the cruelest reality, a black land where death reigns.","18,37",False,/mP4XDDew3VUCNNX7A8SL69BIgRz.jpg,/gZiu9RIcMeQLUaDVqQffQTl6bhy.jpg
463319,Shadow,zh,2018-09-30,6.745,380,13.066,"In a kingdom ruled by a young and unpredictable king, the military commander has a secret weapon: a shadow, a look-alike who can fool both his enemies and the King himself. Now he must use this weapon in an intricate plan that will lead his people to victory in a war that the King does not want.","28,10752",False,/bk2NtbQh84QEsL2bKVCbFx3ZOUa.jpg,/qVXFyASEt1kLpZv9EYze0S0mZe4.jpg
506767,Gad Elmaleh: American Dream,en,2018-03-06,6.6,102,13.054,"In his first English-language special, comedian Gad Elmaleh gleefully digs into America's food obsessions, dating culture, slang, and more.",35,False,/kyMdCTeCgcRjDtwNxXpk82B8Do.jpg,/bukDNap4VXo3KHV9qjCpZeh3v7a.jpg
515911,Lady J,fr,2018-09-12,6.384,272,13.03,"When a romance between a widow and a notorious libertine takes an unexpected turn, Mademoiselle de Joncquières becomes instrumental to one lover’s plans for revenge.","18,10749",False,/fIl89ylwVEb0JVy4rPPId9kiP3f.jpg,/bMws6ZcTwEynkst5PU3Z8OD9wiH.jpg
682708,Young Mother's Friend,ko,2018-09-28,3.5,2,13.017,"After Jae-won goes back to school, he can't find a place to stay so he ends up renting out a room in his mother's friend Hee-jae's house. Hee-jae's daughter Yoon-young has grown up to be a mature young lady. One day, Yoon-young uses school exams as an excuse to stay over with her boyfriend and Jae-won brings his girlfriend to the house. Hee-jae thinks something is going on and interrupts. Meanwhile, Yoon-young is not entirely happy with sex with her boyfriend and has other thoughts when she sees Jae-won. She starts seeing him as a man. In the end, she calls him to her room in the middle of the night...",10749,False,/wLcad1sJejBtigbi6nStDk7sDWe.jpg,/gXJ3lgzO3huSlE0IRXa6pqyz8iP.jpg
436387,Cut Off,de,2018-10-11,6.6,259,13.007,"A coroner finds a capsule in the head of a heavily mutilated corpse, containing a phone number and single word: the name of his daughter.","53,80,27,9648",False,/mlkOIAgd9OfNpKNMQDLYIJus9VV.jpg,/927kgdzuNNHX6wubSbqi50kZse0.jpg
461992,Hostile,en,2018-03-08,5.8,363,12.998,"Juliette, a lone survivor of an apocalyptic era, fights to survive against hunger, thirst, a broken leg and strange disturbing creatures that only come out at nighttime.","18,27,10749,878",False,/2Py1YSWpCA2gsZxl0bPk3sOrL37.jpg,/xnvFRg5TxGYIMKQJjA41lv0RNcg.jpg
457943,Slaughterhouse Rulez,en,2018-10-31,5.58,446,12.992,An illustrious British boarding school becomes a bloody battleground when a mysterious sinkhole appears at a nearby fracking site unleashing unspeakable horror.,"28,35,14,27",False,/GCpxm9p0uyRPcgSKr49CUz6HLI.jpg,/1qjMhKBuF7EIIjsbqV2QZthzU6Q.jpg
447743,Inuyashiki,ja,2018-04-20,7.6,164,12.987,A middle-aged office worker encounters aliens and is gifted with alien technology and limitless powers.,"28,12,878,14",False,/xPdnOm3ATLWgxvRJXXUywp519zs.jpg,/lyqkQ6y7d4YGVQrRjtmGTRMVcDY.jpg
546728,Auntie Edna,en,2018-10-23,7.2,232,12.963,"Taking place during the events of Incredibles 2, Edna Mode babysits Jack-Jack.","16,35,10751,878",False,/qJqj6VAxpbbdJB6CtzYoTSR4SNu.jpg,/cmvGFfq6J63YXvOUGqY5wrZ4b3m.jpg
353576,The Con Is On,en,2018-05-04,3.9,164,12.963,"In an effort to avoid paying off a massive gambling debt to a notorious mobster in England, a couple flees to Los Angeles and hatch a jewel theft plot.","35,80",False,/udGgn3Yz2ghLSAvxDoGyOdanZ9U.jpg,/d4ZzzFOokK356jf6L6vUp3RKNvM.jpg
504891,Secret Love: My Friend's Mom,ko,2018-02-28,5.5,1,12.956,"A student finds his friend's mom very sexy. While studying for tests, she tempts him away from his studies and a hot affair ensues.",10749,False,/asGSbfedsY9EhuycS8GdQoiDRjk.jpg,/iTari5xjCHcQULu7gF2WV7eIbAL.jpg
311307,The Legacy of a Whitetail Deer Hunter,en,2018-03-10,5.1,110,12.912,A star of hunting videos strives to bond with his 12-year-old son on a wilderness trip but learns familial connections can't be forced.,35,False,/5ongvEmzV4H2fYQ4wPSNctgC9PA.jpg,/rEz6ArsPGzVnizMS1fWrvrQcp7t.jpg
546630,100 Things,de,2018-12-06,6.6,289,12.907,"Best friends Toni and Paul decide to relinquish all of their belongings for 100 days, whereby they receive one of their items back on each day. During this challenge the two realize, that the only thing they cannot be without is their friendship. A story about contemporary materialism and the quest for the truly important things in life.","35,18",False,/fqb1odEjdxDrwicf6DZVCKZvrAr.jpg,/yTfpEmMitPaOOmzRZ3NGvLhamz6.jpg
510096,The Swan Princess: A Royal Myztery,en,2018-03-27,6.7,49,12.893,"Your favorite characters are back in an all-new royal adventure! It seems that a mysterious “Z” is appearing as a mark on the palace residents. Who is behind the mark and what does it mean? Princess Odette, Derek, Scully and all the Swan Princess friends work as a team to uncover the secret.","10751,16,12,35",False,/vXRt1Y0RFzWbSKO6wBjLr8yLpzb.jpg,/ljktBZh0wM8yVZcgMt3i43sjkdy.jpg
518671,Shéhérazade,fr,2018-09-05,7.2,255,12.891,"Zachary, 17 years old, gets out of jail. Rejected by his mother, he hangs out in the mean streets of Marseille. He falls in love with Shéhérazade, a young prostitute of whom he becomes the pimp without realizing it...","18,53,10749",False,/v4UuuBHYVIJ6Zwz5fkpEn2fYAKL.jpg,/zW8XIlWjND96WCMPwMZn1z9PG0K.jpg
475132,A Private War,en,2018-11-16,6.809,496,12.89,"One of the most celebrated war correspondents of our time, Marie Colvin is an utterly fearless and rebellious spirit, driven to the frontlines of conflicts across the globe to give voice to the voiceless.","18,10752",False,/a34Q2xknjRKhcG9ZMDa7FjkP05H.jpg,/pAh6uDR9bBznybiJCVYZNJmjg63.jpg
354279,Charming,en,2018-03-26,6.4,256,12.887,"Three fairy tale princesses find themselves engaged to the same guy, Prince Charming.","16,12,35,10751,14,10402",False,/rTefIDfreT1kcjuld8K1wgI3ifp.jpg,/jBkQjdlA1EMD2zSX4WLHDbxs6vX.jpg
425148,Show Dogs,en,2018-05-18,6.0,246,12.883,"Max, a macho, solitary Rottweiler police dog is ordered to go undercover as a primped show dog in a prestigious Dog Show, along with his human partner, to avert a disaster from happening.","12,80,10751,35",False,/pk1zexoUCtjFs761W48QyIPzwCj.jpg,/2dvxCBUfDG2cAdkA921rERxhtcp.jpg
409056,Along Came the Devil,en,2018-08-10,5.7,86,12.873,"After a troubled childhood, Ashley searches for a connection, and unknowingly invites in a demonic force, which leaves her loved ones fighting for her soul.","53,27,18",False,/ltKOlYoilem816Y4d41W4PipHQb.jpg,/rOvieSlNtHB0XAb23wiMCHQwQLD.jpg
517978,The Harvesters,af,2018-08-23,6.0,41,12.849,"South Africa, Free State region, isolated stronghold to the Afrikaans white ethnic minority culture. In this conservative farming territory obsessed with strength and masculinity, Janno is different, secretive, emotionally frail. One day his mother, fiercely religious, brings home Pieter, a hardened street orphan she wants to save, and asks Janno to make this stranger into his brother. The two boys start a fight for power, heritage and parental love.",18,False,/s6lBAPwCSMTAdYItGdYx2xoWnom.jpg,/5cDGIqyXuYMTV8d9B8RwhZInI3g.jpg
467952,The Catcher Was a Spy,en,2018-06-22,6.2,279,12.843,Former major league baseball player Moe Berg lives a double life working for the Office of Strategic Services in World War II Europe.,"18,10752,53",False,/pHFNaNHqiaZ2myMAsylIm2y17c7.jpg,/3aBv9Oln0aoBrEbkMabHIVat6CY.jpg
497814,Breaking In,en,2018-05-05,6.0,656,12.842,"Shaun Russell takes her son and daughter on a weekend getaway to her late father's secluded, high-tech vacation home in the countryside. The family soon gets an unwelcome surprise when four men break into the house to find hidden money. After managing to escape, Shaun must now figure out a way to turn the tables on the desperate thieves and save her captive children.","53,80,28",False,/aEitmeLoFACS2hUEJSo1cDyWosn.jpg,/nuCxJwcQOEKYoiHTgcf4em8TxWv.jpg
448095,I Still See You,en,2018-09-27,6.531,606,12.838,"Ten years after an apocalyptic event left the world haunted by ghosts, Roni receives a threatening message from beyond the grave. Joining forces with a mysterious classmate, Kirk, Roni descends into a shadow world that blurs the bounds of the living and the dead-and begins a desperate race against time to stop a cunning killer.","53,14",False,/7rqpB7coXaNvTVMWb5vL8qU0pBp.jpg,/9fqzZs922V8OmwgO11Eqclof2mQ.jpg
510469,The Troubleshooter,fr,2018-07-25,5.799,172,12.82,"Alex, 43, is not a man of many responsibilities. He works as a tow truck driver in the car repair garage run with an iron fist by his mother Antoinette. She hopes he will someday take over the business, but Alex manages to consistently prove that he’s not up to the task. One day, he assists a woman whose car broke down and ends up spending the night at her place. The next morning, she is nowhere to be found, and Alex discovers he is alone... with three kids!","35,18",False,/ozwlbhx99QAcqHcXutoXDylvLUx.jpg,/gQkChd1FJewppBHKAUBV4GpkZGS.jpg
507256,Whitney,en,2018-07-05,7.4,183,12.783,"Examines the life and career of singer Whitney Houston. Features never-before-seen archival footage, exclusive recordings, rare performances and interviews with the people who knew her best.","10402,99",False,/2i1p4MGPr5yaAhB1vY6ssQjhwPT.jpg,/j1c6dTycYBMZs2T1wKA6bknLLa6.jpg
524708,Blindsided: The Game,es,2018-05-16,8.4,54,12.771,"After blind man Walter Cooke (Eric Jacobus) prevents a local gang from shaking down his local grocer Gordon (Roger Yuan), Walter must reckon with the gang's boss Sal (Joe Bucaro). The stakes are high, but Walter's got an ace up his sleeve.","35,28,18",False,/ws50vG27TqpYhHDDVz9aOFNYCVw.jpg,/iLHz78iJXPyimBZ6RecWoznLi4W.jpg
521127,Kingdoms,es,2018-08-02,6.38,295,12.741,"Alejandro, a freshman, and Sofia, who’s doing her thesis, meet in college. They build an asymmetrical relationship: he’s in love while she just wants to see her sexual desires fulfilled.","18,10749",False,,/ntauOubYAPmGjTe7Kj7tSjr2iPt.jpg
492336,Deep Blue Sea 2,en,2018-04-17,5.1,517,12.734,"When shark conservationist Dr. Misty Calhoun is invited to consult on a top-secret project run by pharmaceutical billionaire Carl Durant, she is shocked to learn that the company is using unpredictable and highly aggressive bull sharks as its test subjects, which soon break loose and cause havoc.","28,27,878",False,/5UKLqsKJIhouJPVr8AQSTuh7S4n.jpg,/xqjAHXMJLORx9vVsCTJ6ZPJcr3D.jpg
532814,The Bad Seed,en,2018-09-09,7.0,288,12.711,A widower suspects that his seemingly perfect adolescent daughter is a heartless killer.,"18,27,53,10770",False,/yt3wwVVZEeE0VvsxooDTwZhY8Ig.jpg,/1m10QitDjpbZgFP1syXgVOv2pH7.jpg
517208,Industrial Accident: The Story of Wax Trax! Records,en,2018-08-16,7.7,13,12.706,"The true story of punks, queers, & criminals on a ride with two men who accidentally changed music along the way.","99,36,10402",False,/omw6hPpaZqbZGNvWNoogi4CKcMw.jpg,/A23u7ydh2K3s1EpP8GTv86NnVXW.jpg
698354,Delicious Sisters,ko,2018-12-19,0.0,0,12.698,"Hyun-ji and Jin-hee are university friends. One day, Jin-hee gets a call from her aunt in the suburbs saying that her son and Jin-hee’s cousin Seug-taek is going to stay with Jin-hee while he attends academy. When they and their friends see each other, they are drawn together.",10749,False,/jZB9MewzyUazCLZAvZvIXXSsB8Q.jpg,/giPRJA8EnvCW9xMrHPWbfvxNnri.jpg
509536,Sex in the Game,ko,2018-03-29,3.0,1,12.676,"Kyung-name lives with an old flame, but is crushing on the model next door. One day he wakes up cuffed and the only way out is by sleeping with the other people trapped with him.",10749,False,/4nHQNTR4cNmOMewYCRXiXIeivkH.jpg,/rU8Nr06xTaRU2EFFImfSnsLsm1e.jpg
534780,Andhadhun,hi,2018-10-05,7.7,501,12.673,A series of mysterious events changes the life of a blind pianist who now must report a crime that was actually never witnessed by him.,"80,9648,53,35",False,/73aKTjdQ46jpv3InqNVnV76Nl0K.jpg,/dy3K6hNvwE05siGgiLJcEiwgpdO.jpg
436549,The Field Guide to Evil,en,2018-10-11,5.571,105,12.664,"A feature-length anthology film. They are known as myths, lore, and folktales. Created to give logic to mankind’s darkest fears, these stories laid the foundation for what we now know as the horror genre.",27,False,/8cVVsfV1YwM55q4pQxhnTXoua1m.jpg,/pWAniWWeBf2qGAYuCPvnvYGs7pM.jpg
548928,The Marine 6: Close Quarters,en,2018-11-02,6.8,168,12.651,"Jake Carter and another former Marine, Luke Trapper,  join forces to rescue a young kidnapped girl from a gang of international criminals.",28,False,/xZ7quy5lXcESorLdPbEepd9hUr3.jpg,/ApPQa5MVbHkVXNKrXHpHSXd1puu.jpg
723384,She and Auntie Live Together,ko,2018-12-07,1.0,1,12.646,"The writer Sook-hee, a narrator, is devoted to creative activities by getting a house in the countryside to write.  But one day, she feel like someone is spying on me.  Even the pink slip that enhances her creativity disappears… …  Sook-hee, afraid to live alone, saves her  Strangely, they start to have a dizzying relationship while being intertwined with their domestic partners.  For Sook-hee, this kind of relationship is a good subject for the novel.  Strangely, however, the domestic partners couldn't have a few days and were kicked out by Sook-hee. …  How will Sook-hee escape from the unidentified gaze watching her?","18,10749",False,/9xhFe899oiiq1VFWdYBf3eSSDck.jpg,/oVZhdEQWg4g52lhWzFU4hzATUXu.jpg
505177,10x10,en,2018-03-16,5.233,553,12.61,"Lewis is an outwardly ordinary guy, but in reality he is hiding an obsession – revenge – against Cathy. Lewis kidnaps Cathy in broad daylight and takes her to his home, where he locks her in a soundproof cell and attempts to extract a dark secret from her past.","18,9648,53",False,/9QWBstBOwv36cuv0hK4esNyFnvo.jpg,/egMETBYual2JtfFGigXTA0tGkME.jpg
522554,Murderous Children,es,2018-03-22,7.2,43,12.607,"4 stories about 4 criminal children. Two teenagers trapped in a world full of drugs and human trafficking, another two kids bring their loved ones to the limit, other two resentful kids want to fulfill their most evil desires, and one kid who has to decide between killing or loving.","18,53",False,/kVSZySpjyl5A6DOIG7bC6C7mCHP.jpg,/xO9wQO4B90BvqdbFKjOQsR9o9eL.jpg
537190,Rampant,ko,2018-10-25,6.9,200,12.591,"Ancient Korea, 17th century. While the paranoid King Lee Jo of Joseon, vassal of the Qing dynasty, feels surrounded by conspirators and rebels, a dark evil emerges from the bowels of a merchant ship and the exiled Prince Lee Cheung returns to the royal court, ignoring that he will have to lead the few capable of defeating the ambitious humans and the bloody monsters who threaten to destroy the kingdom.","28,27,18,14",False,/ylXU65OCcyXU3tZ00CCeTfwGFja.jpg,/g0EsecBQO3nKol7BRozh3ayyi2b.jpg
557972,Take Point,ko,2018-12-26,6.9,111,12.562,"On the day of the U.S. presidential election in 2024, a team of elite mercenaries embark on a secret CIA mission to abduct North Korea's politician in an underground bunker below the Korean Demilitarized Zone. However, they get caught in the crossfire which causes tensions to escalate to the brink of World War III.","28,53",False,/4tOYcEXHXclnD1B7EpVDw4guJoH.jpg,/fl9VBbIGHUoBY6Ixzt9lEGjhxzs.jpg
478820,The Emperor of Paris,fr,2018-12-19,6.3,481,12.545,"Paris, France, early 19th century. The legendary convict François Vidocq lives in disguise trying to escape from a tragic past that torments him. When, after an unfortunate event, he crosses paths with the police chief, he makes a bold decision that will turn the ruthless mastermind of the Parisian underworld against him.","18,80,53",False,/2E2bGNMDOEmTpgiwdI4w7G6mxli.jpg,/7mZBfj3dFIzQgMVfkDwi9u4JBxI.jpg
475214,Farming,en,2018-09-08,6.231,67,12.499,"Based on the writer/director's childhood, FARMING tells the story of a young Nigerian boy, 'farmed out' by his parents to a white British family in the hope of a better future. Instead, he becomes the feared leader of a white skinhead gang.",18,False,/jccbVVWVtiMAa2VluokCVDwkO4F.jpg,/wndlhQGs0KAwQFhaKTVgPd9lkgM.jpg
493551,Operation Finale,en,2018-08-29,6.703,979,12.498,"In 1960, a team of Israeli secret agents is deployed to find Adolf Eichmann, the infamous Nazi architect of the Holocaust, supposedly hidden in Argentina, and get him to Israel to be judged.","18,36,53",False,/mGR157HpQommDbU0MYQFkHLpvtj.jpg,/nlIdPeH5IrR1qRErschnVQeZAQu.jpg
508152,Piggy,es,2018-03-11,6.3,38,12.494,"Sara is an overweight teen who lives in the shadow of a clique of cool girls holidaying in her village. Not even her childhood friend, Claudia, defends her when she's bullied at the local pool in front of an unknown man. Her clothes are stolen and Sara must get home wearing nothing but her bikini.","18,27",False,/rM9N9S78s3zQVfYodrhiZPxOISD.jpg,/etj9vWikudVetTeXKXuT0o6FJY8.jpg
701944,Romance: Mother's Friend,ko,2018-07-10,5.0,2,12.489,"Jung-sik and Dae-soo are twenty-year-old students. They haven't yet had their first time and all they talk about is sex. Since they are unable to seal the deal, they watch porn instead. One day, Min-jung, Jung-sik's mother's friend, moves in with them to stay until her divorce settles. She will make dreams come true.",10749,False,/kUqS2CZfjTG0F5lRrfiHiuxBSTC.jpg,/7FEi9nc1dpqNRULi03k5HdyTm7k.jpg
568332,Taylor Swift: Reputation Stadium Tour,en,2018-12-31,8.3,383,12.485,"Taylor Swift takes the stage in Dallas for the Reputation Stadium Tour and celebrates a monumental night of music, memories and visual magic.",10402,False,/ySaK6hpbCc2OE13ac7ovhgWwR5u.jpg,/u6oXUTtOuJRPdUgUuPAVVJPSKCo.jpg
506460,Deadly Deed: A Fixer Upper Mystery,en,2018-03-11,6.8,27,12.467,"Shannon Hughes has taken on a charity project renovating a grand old Victorian mansion. When a local banker is found murdered inside, Shannon must dust off the clues and cement the truth before her renovation becomes a demolition.","9648,10770",False,/os9BcthT9vfvoSWM3YBH4hvBflV.jpg,/kaWUQ62GFPy0cIn4gKQmiaHsbyd.jpg
491472,At Eternity's Gate,en,2018-11-15,7.0,1444,12.447,"Famed but tormented artist Vincent van Gogh spends his final years in Arles, France, painting masterworks of the natural world that surrounds him.",18,False,/cOUZMd2Cr6uOHcdCDJtWRgVN4aN.jpg,/y4LvHQoX5YunHJ2EMBSjQvOkvD9.jpg
543580,They Shall Not Grow Old,en,2018-11-09,7.8,574,12.446,"A documentary about World War I with never-before-seen footage to commemorate the centennial of Armistice Day, and the end of the war.","99,36,10752",False,/d1WK4WyqjX2WqtCOLD5pn4jxLQN.jpg,/yMGfJeTXUdIjOqjS0jJfjgYEuYC.jpg
476764,The Front Runner,en,2018-11-06,5.886,350,12.436,"Gary Hart, former Senator of Colorado, becomes the front-runner for the Democratic presidential nomination in 1987. Hart's intelligence, charisma and idealism makes him popular with young voters, leaving him with a seemingly clear path to the White House. All that comes crashing down when allegations of an extramarital affair surface in the media, forcing the candidate to address a scandal that threatens to derail his campaign and personal life.","18,36",False,/u5aCHPrmcqglPjjPyG8SwhWygCy.jpg,/9QKzd31H1bCjMAJ8HoaASWqbHfY.jpg
504056,Big Brother,zh,2018-08-16,7.4,168,12.417,"A soldier-turned-high school teacher uses unusual methods to reach to a class of poor students, while dealing with a greedy entrepreneur and his gang of fighters as well as the government.","28,18,35",False,/5MyjGUa2piiEyNH4UcLp3YV9cwo.jpg,/z6Y6uQn2fORr7o43EggQrTsp08o.jpg
501851,Ouija House,en,2018-05-05,5.4,108,12.417,"A graduate student, who is trying to finish the last of her research on a book project that she hopes will help her down-on-her-luck mother, brings friends to a house with a dark past, where they soon unwittingly summon an evil entity who makes the house part of its game…",27,False,/aR995Sqw0GcOzmQxNiBGuLukOYW.jpg,/sLuFHWp2lAJMqLIinspmtBG3c0j.jpg
426613,The Miseducation of Cameron Post,en,2018-07-18,6.933,949,12.411,"Pennsylvania, 1993. After getting caught with another girl, teenager Cameron Post is sent to a conversion therapy center run by the strict Dr. Lydia Marsh and her brother, Reverend Rick, whose treatment consists in repenting for feeling “same sex attraction.” Cameron befriends fellow sinners Jane and Adam, thus creating a new family to deal with the surrounding intolerance.",18,False,/lqmNJ2dEqC5afCmYeLUiC6bYDUI.jpg,/xFLJDW3na8AADFzQJT6bM1VU5zs.jpg
479226,The Purity of Vengeance,da,2018-10-04,7.2,476,12.405,"Copenhagen, 2018. A frightening discovery is made in an old apartment. The subsequent investigation of Department Q leads them to an infamous institution for girls that was suddenly closed in the early sixties.","80,53,9648,18",False,/9lOtDZY6oy6qUlYH78fJ27RMkLP.jpg,/uTdaeGpznkLfyhAzLlrdssD621R.jpg
508466,Sad Hill Unearthed,es,2018-10-19,6.9,106,12.386,"Province of Burgos, northern Spain, October 2015. A group of fans undertake the titanic task of restoring the location of the last scene of The Good, the Bad and the Ugly, the mythical spaghetti western directed by Italian filmmaker Sergio Leone in 1966.","99,36",False,/jJMayZ9Pz66DEU7AocbiU4HuejC.jpg,/1DgoWzjWlLzN4GuLgrIe2iScTPt.jpg
496274,The Thinning: New World Order,en,2018-10-17,7.0,116,12.361,Blake Redding is trapped in this dark room wanting to protect his love so the only thing he will do is escape like no failed student has done before.,"28,18,53,27",False,/vhJ4WmM7RZtjRuTGeRLgNTjoIVl.jpg,/uQtYfyldOV3mPzclKr0K90FTS0n.jpg
518997,The Daughters of Fire,es,2018-10-28,4.1,27,12.352,"Three women meet by chance at the end of the world, in Argentinian Patagonia, and set out on a polyamorous journey, caught up in the search for new kinds of relationships, far from possession and pain. They become the Daughters of Fire, a band dedicated to helping those women who look for their own path to erotica.",18,False,/x42ljBaT4Y7sELPGVYo9hihLv9j.jpg,/k2w1f0Co3dgIKTSmNn13Y31ppPu.jpg
